Sheet: Calendar
E1: Hols Year | F1: Carried Over Expiry | G1: Carried Over (Mx 8) | H1: To Have+Leave Carried | I1: Booked | J1: Left | L1: Days Carried over, only 8. Will expire Last day of April next year.
E2: 2024 | F2: =DATE(hols_year,5,1) -> 2024-05-01T00:00:00.000 | G2: 8 | H2: =R[1]C+R[1]C[-1] -> 36 | I2: =SUM(Leave!C5) -> 0 | J2: =R[1]C[-2]-RC[-1]+IF(RC[-1]>RC[-3],RC[-3],R[1]C[-3]) -> 36 | L2: Any more will expire by end of current year. | Q2: =IFERROR(IF(INDEX(Leave!C5,MATCH(R[4]C[-13],Leave!C1,0))<1,TRUE,FALSE),FALSE) -> 0
F3: Live Carried Over-> | G3: =(IF(TODAY()<R[-1]C[-1],R[-1]C,0)) -> 8 | H3: 28 | I3: <-Hol Days
D4: 2024 | P4: =YEAR(R[2]C) -> 2025 | AB4: =YEAR(R[2]C) -> 2026
A5: =R[1]C -> 2023-10-01T00:00:00.000 | B5: =R[1]C -> 2023-11-01T00:00:00.000 | C5: =R[1]C -> 2023-12-01T00:00:00.000 | D5: =R[1]C -> 2024-01-01T00:00:00.000 | E5: =R[1]C -> 2024-02-01T00:00:00.000 | F5: =R[1]C -> 2024-03-01T00:00:00.000 | G5: =R[1]C -> 2024-04-01T00:00:00.000 | H5: =R[1]C -> 2024-05-01T00:00:00.000 | I5: =R[1]C -> 2024-06-01T00:00:00.000 | J5: =R[1]C -> 2024-07-01T00:00:00.000 | K5: =R[1]C -> 2024-08-01T00:00:00.000 | L5: =R[1]C -> 2024-09-01T00:00:00.000 | M5: =R[1]C -> 2024-10-01T00:00:00.000 | N5: =R[1]C -> 2024-11-01T00:00:00.000 | O5: =R[1]C -> 2024-12-01T00:00:00.000 | P5: =R[1]C -> 2025-01-01T00:00:00.000 | Q5: =R[1]C -> 2025-02-01T00:00:00.000 | R5: =R[1]C -> 2025-03-01T00:00:00.000 | S5: =R[1]C -> 2025-04-01T00:00:00.000 | T5: =R[1]C -> 2025-05-01T00:00:00.000 | U5: =R[1]C -> 2025-06-01T00:00:00.000 | V5: =R[1]C -> 2025-07-01T00:00:00.000 | W5: =R[1]C -> 2025-08-01T00:00:00.000 | X5: =R[1]C -> 2025-09-01T00:00:00.000 | Y5: =R[1]C -> 2025-10-01T00:00:00.000 | Z5: =R[1]C -> 2025-11-01T00:00:00.000 | AA5: =R[1]C -> 2025-12-01T00:00:00.000 | AB5: =R[1]C -> 2026-01-01T00:00:00.000
A6: =DATE(YEAR(RC[1]),MONTH(RC[1])-1,1) -> 2023-10-01T00:00:00.000 | B6: =DATE(YEAR(RC[1]),MONTH(RC[1])-1,1) -> 2023-11-01T00:00:00.000 | C6: =DATE(YEAR(RC[1]),MONTH(RC[1])-1,1) -> 2023-12-01T00:00:00.000 | D6: =DATE(R[-2]C,1,1) -> 2024-01-01T00:00:00.000 | E6: =DATE(YEAR(RC[-1]),MONTH(RC[-1])+1,1) -> 2024-02-01T00:00:00.000 | F6: =DATE(YEAR(RC[-1]),MONTH(RC[-1])+1,1) -> 2024-03-01T00:00:00.000 | G6: =DATE(YEAR(RC[-1]),MONTH(RC[-1])+1,1) -> 2024-04-01T00:00:00.000 | H6: =DATE(YEAR(RC[-1]),MONTH(RC[-1])+1,1) -> 2024-05-01T00:00:00.000 | I6: =DATE(YEAR(RC[-1]),MONTH(RC[-1])+1,1) -> 2024-06-01T00:00:00.000 | J6: =DATE(YEAR(RC[-1]),MONTH(RC[-1])+1,1) -> 2024-07-01T00:00:00.000 | K6: =DATE(YEAR(RC[-1]),MONTH(RC[-1])+1,1) -> 2024-08-01T00:00:00.000 | L6: =DATE(YEAR(RC[-1]),MONTH(RC[-1])+1,1) -> 2024-09-01T00:00:00.000 | M6: =DATE(YEAR(RC[-1]),MONTH(RC[-1])+1,1) -> 2024-10-01T00:00:00.000 | N6: =DATE(YEAR(RC[-1]),MONTH(RC[-1])+1,1) -> 2024-11-01T00:00:00.000 | O6: =DATE(YEAR(RC[-1]),MONTH(RC[-1])+1,1) -> 2024-12-01T00:00:00.000 | P6: =DATE(YEAR(RC[-1]),MONTH(RC[-1])+1,1) -> 2025-01-01T00:00:00.000 | Q6: =DATE(YEAR(RC[-1]),MONTH(RC[-1])+1,1) -> 2025-02-01T00:00:00.000 | R6: =DATE(YEAR(RC[-1]),MONTH(RC[-1])+1,1) -> 2025-03-01T00:00:00.000 | S6: =DATE(YEAR(RC[-1]),MONTH(RC[-1])+1,1) -> 2025-04-01T00:00:00.000 | T6: =DATE(YEAR(RC[-1]),MONTH(RC[-1])+1,1) -> 2025-05-01T00:00:00.000 | U6: =DATE(YEAR(RC[-1]),MONTH(RC[-1])+1,1) -> 2025-06-01T00:00:00.000 | V6: =DATE(YEAR(RC[-1]),MONTH(RC[-1])+1,1) -> 2025-07-01T00:00:00.000 | W6: =DATE(YEAR(RC[-1]),MONTH(RC[-1])+1,1) -> 2025-08-01T00:00:00.000 | X6: =DATE(YEAR(RC[-1]),MONTH(RC[-1])+1,1) -> 2025-09-01T00:00:00.000 | Y6: =DATE(YEAR(RC[-1]),MONTH(RC[-1])+1,1) -> 2025-10-01T00:00:00.000 | Z6: =DATE(YEAR(RC[-1]),MONTH(RC[-1])+1,1) -> 2025-11-01T00:00:00.000 | AA6: =DATE(YEAR(RC[-1]),MONTH(RC[-1])+1,1) -> 2025-12-01T00:00:00.000 | AB6: =DATE(YEAR(RC[-1]),MONTH(RC[-1])+1,1) -> 2026-01-01T00:00:00.000
A7: =R[-1]C+1 -> 2023-10-02T00:00:00.000 | B7: =R[-1]C+1 -> 2023-11-02T00:00:00.000 | C7: =R[-1]C+1 -> 2023-12-02T00:00:00.000 | D7: =R[-1]C+1 -> 2024-01-02T00:00:00.000 | E7: =R[-1]C+1 -> 2024-02-02T00:00:00.000 | F7: =R[-1]C+1 -> 2024-03-02T00:00:00.000 | G7: =R[-1]C+1 -> 2024-04-02T00:00:00.000 | H7: =R[-1]C+1 -> 2024-05-02T00:00:00.000 | I7: =R[-1]C+1 -> 2024-06-02T00:00:00.000 | J7: =R[-1]C+1 -> 2024-07-02T00:00:00.000 | K7: =R[-1]C+1 -> 2024-08-02T00:00:00.000 | L7: =R[-1]C+1 -> 2024-09-02T00:00:00.000 | M7: =R[-1]C+1 -> 2024-10-02T00:00:00.000 | N7: =R[-1]C+1 -> 2024-11-02T00:00:00.000 | O7: =R[-1]C+1 -> 2024-12-02T00:00:00.000 | P7: =R[-1]C+1 -> 2025-01-02T00:00:00.000 | Q7: =R[-1]C+1 -> 2025-02-02T00:00:00.000 | R7: =R[-1]C+1 -> 2025-03-02T00:00:00.000 | S7: =R[-1]C+1 -> 2025-04-02T00:00:00.000 | T7: =R[-1]C+1 -> 2025-05-02T00:00:00.000 | U7: =R[-1]C+1 -> 2025-06-02T00:00:00.000 | V7: =R[-1]C+1 -> 2025-07-02T00:00:00.000 | W7: =R[-1]C+1 -> 2025-08-02T00:00:00.000 | X7: =R[-1]C+1 -> 2025-09-02T00:00:00.000 | Y7: =R[-1]C+1 -> 2025-10-02T00:00:00.000 | Z7: =R[-1]C+1 -> 2025-11-02T00:00:00.000 | AA7: =R[-1]C+1 -> 2025-12-02T00:00:00.000 | AB7: =R[-1]C+1 -> 2026-01-02T00:00:00.000
A8: =R[-1]C+1 -> 2023-10-03T00:00:00.000 | B8: =R[-1]C+1 -> 2023-11-03T00:00:00.000 | C8: =R[-1]C+1 -> 2023-12-03T00:00:00.000 | D8: =R[-1]C+1 -> 2024-01-03T00:00:00.000 | E8: =R[-1]C+1 -> 2024-02-03T00:00:00.000 | F8: =R[-1]C+1 -> 2024-03-03T00:00:00.000 | G8: =R[-1]C+1 -> 2024-04-03T00:00:00.000 | H8: =R[-1]C+1 -> 2024-05-03T00:00:00.000 | I8: =R[-1]C+1 -> 2024-06-03T00:00:00.000 | J8: =R[-1]C+1 -> 2024-07-03T00:00:00.000 | K8: =R[-1]C+1 -> 2024-08-03T00:00:00.000 | L8: =R[-1]C+1 -> 2024-09-03T00:00:00.000 | M8: =R[-1]C+1 -> 2024-10-03T00:00:00.000 | N8: =R[-1]C+1 -> 2024-11-03T00:00:00.000 | O8: =R[-1]C+1 -> 2024-12-03T00:00:00.000 | P8: =R[-1]C+1 -> 2025-01-03T00:00:00.000 | Q8: =R[-1]C+1 -> 2025-02-03T00:00:00.000 | R8: =R[-1]C+1 -> 2025-03-03T00:00:00.000 | S8: =R[-1]C+1 -> 2025-04-03T00:00:00.000 | T8: =R[-1]C+1 -> 2025-05-03T00:00:00.000 | U8: =R[-1]C+1 -> 2025-06-03T00:00:00.000 | V8: =R[-1]C+1 -> 2025-07-03T00:00:00.000 | W8: =R[-1]C+1 -> 2025-08-03T00:00:00.000 | X8: =R[-1]C+1 -> 2025-09-03T00:00:00.000 | Y8: =R[-1]C+1 -> 2025-10-03T00:00:00.000 | Z8: =R[-1]C+1 -> 2025-11-03T00:00:00.000 | AA8: =R[-1]C+1 -> 2025-12-03T00:00:00.000 | AB8: =R[-1]C+1 -> 2026-01-03T00:00:00.000
A9: =R[-1]C+1 -> 2023-10-04T00:00:00.000 | B9: =R[-1]C+1 -> 2023-11-04T00:00:00.000 | C9: =R[-1]C+1 -> 2023-12-04T00:00:00.000 | D9: =R[-1]C+1 -> 2024-01-04T00:00:00.000 | E9: =R[-1]C+1 -> 2024-02-04T00:00:00.000 | F9: =R[-1]C+1 -> 2024-03-04T00:00:00.000 | G9: =R[-1]C+1 -> 2024-04-04T00:00:00.000 | H9: =R[-1]C+1 -> 2024-05-04T00:00:00.000 | I9: =R[-1]C+1 -> 2024-06-04T00:00:00.000 | J9: =R[-1]C+1 -> 2024-07-04T00:00:00.000 | K9: =R[-1]C+1 -> 2024-08-04T00:00:00.000 | L9: =R[-1]C+1 -> 2024-09-04T00:00:00.000 | M9: =R[-1]C+1 -> 2024-10-04T00:00:00.000 | N9: =R[-1]C+1 -> 2024-11-04T00:00:00.000 | O9: =R[-1]C+1 -> 2024-12-04T00:00:00.000 | P9: =R[-1]C+1 -> 2025-01-04T00:00:00.000 | Q9: =R[-1]C+1 -> 2025-02-04T00:00:00.000 | R9: =R[-1]C+1 -> 2025-03-04T00:00:00.000 | S9: =R[-1]C+1 -> 2025-04-04T00:00:00.000 | T9: =R[-1]C+1 -> 2025-05-04T00:00:00.000 | U9: =R[-1]C+1 -> 2025-06-04T00:00:00.000 | V9: =R[-1]C+1 -> 2025-07-04T00:00:00.000 | W9: =R[-1]C+1 -> 2025-08-04T00:00:00.000 | X9: =R[-1]C+1 -> 2025-09-04T00:00:00.000 | Y9: =R[-1]C+1 -> 2025-10-04T00:00:00.000 | Z9: =R[-1]C+1 -> 2025-11-04T00:00:00.000 | AA9: =R[-1]C+1 -> 2025-12-04T00:00:00.000 | AB9: =R[-1]C+1 -> 2026-01-04T00:00:00.000
A10: =R[-1]C+1 -> 2023-10-05T00:00:00.000 | B10: =R[-1]C+1 -> 2023-11-05T00:00:00.000 | C10: =R[-1]C+1 -> 2023-12-05T00:00:00.000 | D10: =R[-1]C+1 -> 2024-01-05T00:00:00.000 | E10: =R[-1]C+1 -> 2024-02-05T00:00:00.000 | F10: =R[-1]C+1 -> 2024-03-05T00:00:00.000 | G10: =R[-1]C+1 -> 2024-04-05T00:00:00.000 | H10: =R[-1]C+1 -> 2024-05-05T00:00:00.000 | I10: =R[-1]C+1 -> 2024-06-05T00:00:00.000 | J10: =R[-1]C+1 -> 2024-07-05T00:00:00.000 | K10: =R[-1]C+1 -> 2024-08-05T00:00:00.000 | L10: =R[-1]C+1 -> 2024-09-05T00:00:00.000 | M10: =R[-1]C+1 -> 2024-10-05T00:00:00.000 | N10: =R[-1]C+1 -> 2024-11-05T00:00:00.000 | O10: =R[-1]C+1 -> 2024-12-05T00:00:00.000 | P10: =R[-1]C+1 -> 2025-01-05T00:00:00.000 | Q10: =R[-1]C+1 -> 2025-02-05T00:00:00.000 | R10: =R[-1]C+1 -> 2025-03-05T00:00:00.000 | S10: =R[-1]C+1 -> 2025-04-05T00:00:00.000 | T10: =R[-1]C+1 -> 2025-05-05T00:00:00.000 | U10: =R[-1]C+1 -> 2025-06-05T00:00:00.000 | V10: =R[-1]C+1 -> 2025-07-05T00:00:00.000 | W10: =R[-1]C+1 -> 2025-08-05T00:00:00.000 | X10: =R[-1]C+1 -> 2025-09-05T00:00:00.000 | Y10: =R[-1]C+1 -> 2025-10-05T00:00:00.000 | Z10: =R[-1]C+1 -> 2025-11-05T00:00:00.000 | AA10: =R[-1]C+1 -> 2025-12-05T00:00:00.000 | AB10: =R[-1]C+1 -> 2026-01-05T00:00:00.000
A11: =R[-1]C+1 -> 2023-10-06T00:00:00.000 | B11: =R[-1]C+1 -> 2023-11-06T00:00:00.000 | C11: =R[-1]C+1 -> 2023-12-06T00:00:00.000 | D11: =R[-1]C+1 -> 2024-01-06T00:00:00.000 | E11: =R[-1]C+1 -> 2024-02-06T00:00:00.000 | F11: =R[-1]C+1 -> 2024-03-06T00:00:00.000 | G11: =R[-1]C+1 -> 2024-04-06T00:00:00.000 | H11: =R[-1]C+1 -> 2024-05-06T00:00:00.000 | I11: =R[-1]C+1 -> 2024-06-06T00:00:00.000 | J11: =R[-1]C+1 -> 2024-07-06T00:00:00.000 | K11: =R[-1]C+1 -> 2024-08-06T00:00:00.000 | L11: =R[-1]C+1 -> 2024-09-06T00:00:00.000 | M11: =R[-1]C+1 -> 2024-10-06T00:00:00.000 | N11: =R[-1]C+1 -> 2024-11-06T00:00:00.000 | O11: =R[-1]C+1 -> 2024-12-06T00:00:00.000 | P11: =R[-1]C+1 -> 2025-01-06T00:00:00.000 | Q11: =R[-1]C+1 -> 2025-02-06T00:00:00.000 | R11: =R[-1]C+1 -> 2025-03-06T00:00:00.000 | S11: =R[-1]C+1 -> 2025-04-06T00:00:00.000 | T11: =R[-1]C+1 -> 2025-05-06T00:00:00.000 | U11: =R[-1]C+1 -> 2025-06-06T00:00:00.000 | V11: =R[-1]C+1 -> 2025-07-06T00:00:00.000 | W11: =R[-1]C+1 -> 2025-08-06T00:00:00.000 | X11: =R[-1]C+1 -> 2025-09-06T00:00:00.000 | Y11: =R[-1]C+1 -> 2025-10-06T00:00:00.000 | Z11: =R[-1]C+1 -> 2025-11-06T00:00:00.000 | AA11: =R[-1]C+1 -> 2025-12-06T00:00:00.000 | AB11: =R[-1]C+1 -> 2026-01-06T00:00:00.000
A12: =R[-1]C+1 -> 2023-10-07T00:00:00.000 | B12: =R[-1]C+1 -> 2023-11-07T00:00:00.000 | C12: =R[-1]C+1 -> 2023-12-07T00:00:00.000 | D12: =R[-1]C+1 -> 2024-01-07T00:00:00.000 | E12: =R[-1]C+1 -> 2024-02-07T00:00:00.000 | F12: =R[-1]C+1 -> 2024-03-07T00:00:00.000 | G12: =R[-1]C+1 -> 2024-04-07T00:00:00.000 | H12: =R[-1]C+1 -> 2024-05-07T00:00:00.000 | I12: =R[-1]C+1 -> 2024-06-07T00:00:00.000 | J12: =R[-1]C+1 -> 2024-07-07T00:00:00.000 | K12: =R[-1]C+1 -> 2024-08-07T00:00:00.000 | L12: =R[-1]C+1 -> 2024-09-07T00:00:00.000 | M12: =R[-1]C+1 -> 2024-10-07T00:00:00.000 | N12: =R[-1]C+1 -> 2024-11-07T00:00:00.000 | O12: =R[-1]C+1 -> 2024-12-07T00:00:00.000 | P12: =R[-1]C+1 -> 2025-01-07T00:00:00.000 | Q12: =R[-1]C+1 -> 2025-02-07T00:00:00.000 | R12: =R[-1]C+1 -> 2025-03-07T00:00:00.000 | S12: =R[-1]C+1 -> 2025-04-07T00:00:00.000 | T12: =R[-1]C+1 -> 2025-05-07T00:00:00.000 | U12: =R[-1]C+1 -> 2025-06-07T00:00:00.000 | V12: =R[-1]C+1 -> 2025-07-07T00:00:00.000 | W12: =R[-1]C+1 -> 2025-08-07T00:00:00.000 | X12: =R[-1]C+1 -> 2025-09-07T00:00:00.000 | Y12: =R[-1]C+1 -> 2025-10-07T00:00:00.000 | Z12: =R[-1]C+1 -> 2025-11-07T00:00:00.000 | AA12: =R[-1]C+1 -> 2025-12-07T00:00:00.000 | AB12: =R[-1]C+1 -> 2026-01-07T00:00:00.000
A13: =R[-1]C+1 -> 2023-10-08T00:00:00.000 | B13: =R[-1]C+1 -> 2023-11-08T00:00:00.000 | C13: =R[-1]C+1 -> 2023-12-08T00:00:00.000 | D13: =R[-1]C+1 -> 2024-01-08T00:00:00.000 | E13: =R[-1]C+1 -> 2024-02-08T00:00:00.000 | F13: =R[-1]C+1 -> 2024-03-08T00:00:00.000 | G13: =R[-1]C+1 -> 2024-04-08T00:00:00.000 | H13: =R[-1]C+1 -> 2024-05-08T00:00:00.000 | I13: =R[-1]C+1 -> 2024-06-08T00:00:00.000 | J13: =R[-1]C+1 -> 2024-07-08T00:00:00.000 | K13: =R[-1]C+1 -> 2024-08-08T00:00:00.000 | L13: =R[-1]C+1 -> 2024-09-08T00:00:00.000 | M13: =R[-1]C+1 -> 2024-10-08T00:00:00.000 | N13: =R[-1]C+1 -> 2024-11-08T00:00:00.000 | O13: =R[-1]C+1 -> 2024-12-08T00:00:00.000 | P13: =R[-1]C+1 -> 2025-01-08T00:00:00.000 | Q13: =R[-1]C+1 -> 2025-02-08T00:00:00.000 | R13: =R[-1]C+1 -> 2025-03-08T00:00:00.000 | S13: =R[-1]C+1 -> 2025-04-08T00:00:00.000 | T13: =R[-1]C+1 -> 2025-05-08T00:00:00.000 | U13: =R[-1]C+1 -> 2025-06-08T00:00:00.000 | V13: =R[-1]C+1 -> 2025-07-08T00:00:00.000 | W13: =R[-1]C+1 -> 2025-08-08T00:00:00.000 | X13: =R[-1]C+1 -> 2025-09-08T00:00:00.000 | Y13: =R[-1]C+1 -> 2025-10-08T00:00:00.000 | Z13: =R[-1]C+1 -> 2025-11-08T00:00:00.000 | AA13: =R[-1]C+1 -> 2025-12-08T00:00:00.000 | AB13: =R[-1]C+1 -> 2026-01-08T00:00:00.000
A14: =R[-1]C+1 -> 2023-10-09T00:00:00.000 | B14: =R[-1]C+1 -> 2023-11-09T00:00:00.000 | C14: =R[-1]C+1 -> 2023-12-09T00:00:00.000 | D14: =R[-1]C+1 -> 2024-01-09T00:00:00.000 | E14: =R[-1]C+1 -> 2024-02-09T00:00:00.000 | F14: =R[-1]C+1 -> 2024-03-09T00:00:00.000 | G14: =R[-1]C+1 -> 2024-04-09T00:00:00.000 | H14: =R[-1]C+1 -> 2024-05-09T00:00:00.000 | I14: =R[-1]C+1 -> 2024-06-09T00:00:00.000 | J14: =R[-1]C+1 -> 2024-07-09T00:00:00.000 | K14: =R[-1]C+1 -> 2024-08-09T00:00:00.000 | L14: =R[-1]C+1 -> 2024-09-09T00:00:00.000 | M14: =R[-1]C+1 -> 2024-10-09T00:00:00.000 | N14: =R[-1]C+1 -> 2024-11-09T00:00:00.000 | O14: =R[-1]C+1 -> 2024-12-09T00:00:00.000 | P14: =R[-1]C+1 -> 2025-01-09T00:00:00.000 | Q14: =R[-1]C+1 -> 2025-02-09T00:00:00.000 | R14: =R[-1]C+1 -> 2025-03-09T00:00:00.000 | S14: =R[-1]C+1 -> 2025-04-09T00:00:00.000 | T14: =R[-1]C+1 -> 2025-05-09T00:00:00.000 | U14: =R[-1]C+1 -> 2025-06-09T00:00:00.000 | V14: =R[-1]C+1 -> 2025-07-09T00:00:00.000 | W14: =R[-1]C+1 -> 2025-08-09T00:00:00.000 | X14: =R[-1]C+1 -> 2025-09-09T00:00:00.000 | Y14: =R[-1]C+1 -> 2025-10-09T00:00:00.000 | Z14: =R[-1]C+1 -> 2025-11-09T00:00:00.000 | AA14: =R[-1]C+1 -> 2025-12-09T00:00:00.000 | AB14: =R[-1]C+1 -> 2026-01-09T00:00:00.000
A15: =R[-1]C+1 -> 2023-10-10T00:00:00.000 | B15: =R[-1]C+1 -> 2023-11-10T00:00:00.000 | C15: =R[-1]C+1 -> 2023-12-10T00:00:00.000 | D15: =R[-1]C+1 -> 2024-01-10T00:00:00.000 | E15: =R[-1]C+1 -> 2024-02-10T00:00:00.000 | F15: =R[-1]C+1 -> 2024-03-10T00:00:00.000 | G15: =R[-1]C+1 -> 2024-04-10T00:00:00.000 | H15: =R[-1]C+1 -> 2024-05-10T00:00:00.000 | I15: =R[-1]C+1 -> 2024-06-10T00:00:00.000 | J15: =R[-1]C+1 -> 2024-07-10T00:00:00.000 | K15: =R[-1]C+1 -> 2024-08-10T00:00:00.000 | L15: =R[-1]C+1 -> 2024-09-10T00:00:00.000 | M15: =R[-1]C+1 -> 2024-10-10T00:00:00.000 | N15: =R[-1]C+1 -> 2024-11-10T00:00:00.000 | O15: =R[-1]C+1 -> 2024-12-10T00:00:00.000 | P15: =R[-1]C+1 -> 2025-01-10T00:00:00.000 | Q15: =R[-1]C+1 -> 2025-02-10T00:00:00.000 | R15: =R[-1]C+1 -> 2025-03-10T00:00:00.000 | S15: =R[-1]C+1 -> 2025-04-10T00:00:00.000 | T15: =R[-1]C+1 -> 2025-05-10T00:00:00.000 | U15: =R[-1]C+1 -> 2025-06-10T00:00:00.000 | V15: =R[-1]C+1 -> 2025-07-10T00:00:00.000 | W15: =R[-1]C+1 -> 2025-08-10T00:00:00.000 | X15: =R[-1]C+1 -> 2025-09-10T00:00:00.000 | Y15: =R[-1]C+1 -> 2025-10-10T00:00:00.000 | Z15: =R[-1]C+1 -> 2025-11-10T00:00:00.000 | AA15: =R[-1]C+1 -> 2025-12-10T00:00:00.000 | AB15: =R[-1]C+1 -> 2026-01-10T00:00:00.000
A16: =R[-1]C+1 -> 2023-10-11T00:00:00.000 | B16: =R[-1]C+1 -> 2023-11-11T00:00:00.000 | C16: =R[-1]C+1 -> 2023-12-11T00:00:00.000 | D16: =R[-1]C+1 -> 2024-01-11T00:00:00.000 | E16: =R[-1]C+1 -> 2024-02-11T00:00:00.000 | F16: =R[-1]C+1 -> 2024-03-11T00:00:00.000 | G16: =R[-1]C+1 -> 2024-04-11T00:00:00.000 | H16: =R[-1]C+1 -> 2024-05-11T00:00:00.000 | I16: =R[-1]C+1 -> 2024-06-11T00:00:00.000 | J16: =R[-1]C+1 -> 2024-07-11T00:00:00.000 | K16: =R[-1]C+1 -> 2024-08-11T00:00:00.000 | L16: =R[-1]C+1 -> 2024-09-11T00:00:00.000 | M16: =R[-1]C+1 -> 2024-10-11T00:00:00.000 | N16: =R[-1]C+1 -> 2024-11-11T00:00:00.000 | O16: =R[-1]C+1 -> 2024-12-11T00:00:00.000 | P16: =R[-1]C+1 -> 2025-01-11T00:00:00.000 | Q16: =R[-1]C+1 -> 2025-02-11T00:00:00.000 | R16: =R[-1]C+1 -> 2025-03-11T00:00:00.000 | S16: =R[-1]C+1 -> 2025-04-11T00:00:00.000 | T16: =R[-1]C+1 -> 2025-05-11T00:00:00.000 | U16: =R[-1]C+1 -> 2025-06-11T00:00:00.000 | V16: =R[-1]C+1 -> 2025-07-11T00:00:00.000 | W16: =R[-1]C+1 -> 2025-08-11T00:00:00.000 | X16: =R[-1]C+1 -> 2025-09-11T00:00:00.000 | Y16: =R[-1]C+1 -> 2025-10-11T00:00:00.000 | Z16: =R[-1]C+1 -> 2025-11-11T00:00:00.000 | AA16: =R[-1]C+1 -> 2025-12-11T00:00:00.000 | AB16: =R[-1]C+1 -> 2026-01-11T00:00:00.000
A17: =R[-1]C+1 -> 2023-10-12T00:00:00.000 | B17: =R[-1]C+1 -> 2023-11-12T00:00:00.000 | C17: =R[-1]C+1 -> 2023-12-12T00:00:00.000 | D17: =R[-1]C+1 -> 2024-01-12T00:00:00.000 | E17: =R[-1]C+1 -> 2024-02-12T00:00:00.000 | F17: =R[-1]C+1 -> 2024-03-12T00:00:00.000 | G17: =R[-1]C+1 -> 2024-04-12T00:00:00.000 | H17: =R[-1]C+1 -> 2024-05-12T00:00:00.000 | I17: =R[-1]C+1 -> 2024-06-12T00:00:00.000 | J17: =R[-1]C+1 -> 2024-07-12T00:00:00.000 | K17: =R[-1]C+1 -> 2024-08-12T00:00:00.000 | L17: =R[-1]C+1 -> 2024-09-12T00:00:00.000 | M17: =R[-1]C+1 -> 2024-10-12T00:00:00.000 | N17: =R[-1]C+1 -> 2024-11-12T00:00:00.000 | O17: =R[-1]C+1 -> 2024-12-12T00:00:00.000 | P17: =R[-1]C+1 -> 2025-01-12T00:00:00.000 | Q17: =R[-1]C+1 -> 2025-02-12T00:00:00.000 | R17: =R[-1]C+1 -> 2025-03-12T00:00:00.000 | S17: =R[-1]C+1 -> 2025-04-12T00:00:00.000 | T17: =R[-1]C+1 -> 2025-05-12T00:00:00.000 | U17: =R[-1]C+1 -> 2025-06-12T00:00:00.000 | V17: =R[-1]C+1 -> 2025-07-12T00:00:00.000 | W17: =R[-1]C+1 -> 2025-08-12T00:00:00.000 | X17: =R[-1]C+1 -> 2025-09-12T00:00:00.000 | Y17: =R[-1]C+1 -> 2025-10-12T00:00:00.000 | Z17: =R[-1]C+1 -> 2025-11-12T00:00:00.000 | AA17: =R[-1]C+1 -> 2025-12-12T00:00:00.000 | AB17: =R[-1]C+1 -> 2026-01-12T00:00:00.000
A18: =R[-1]C+1 -> 2023-10-13T00:00:00.000 | B18: =R[-1]C+1 -> 2023-11-13T00:00:00.000 | C18: =R[-1]C+1 -> 2023-12-13T00:00:00.000 | D18: =R[-1]C+1 -> 2024-01-13T00:00:00.000 | E18: =R[-1]C+1 -> 2024-02-13T00:00:00.000 | F18: =R[-1]C+1 -> 2024-03-13T00:00:00.000 | G18: =R[-1]C+1 -> 2024-04-13T00:00:00.000 | H18: =R[-1]C+1 -> 2024-05-13T00:00:00.000 | I18: =R[-1]C+1 -> 2024-06-13T00:00:00.000 | J18: =R[-1]C+1 -> 2024-07-13T00:00:00.000 | K18: =R[-1]C+1 -> 2024-08-13T00:00:00.000 | L18: =R[-1]C+1 -> 2024-09-13T00:00:00.000 | M18: =R[-1]C+1 -> 2024-10-13T00:00:00.000 | N18: =R[-1]C+1 -> 2024-11-13T00:00:00.000 | O18: =R[-1]C+1 -> 2024-12-13T00:00:00.000 | P18: =R[-1]C+1 -> 2025-01-13T00:00:00.000 | Q18: =R[-1]C+1 -> 2025-02-13T00:00:00.000 | R18: =R[-1]C+1 -> 2025-03-13T00:00:00.000 | S18: =R[-1]C+1 -> 2025-04-13T00:00:00.000 | T18: =R[-1]C+1 -> 2025-05-13T00:00:00.000 | U18: =R[-1]C+1 -> 2025-06-13T00:00:00.000 | V18: =R[-1]C+1 -> 2025-07-13T00:00:00.000 | W18: =R[-1]C+1 -> 2025-08-13T00:00:00.000 | X18: =R[-1]C+1 -> 2025-09-13T00:00:00.000 | Y18: =R[-1]C+1 -> 2025-10-13T00:00:00.000 | Z18: =R[-1]C+1 -> 2025-11-13T00:00:00.000 | AA18: =R[-1]C+1 -> 2025-12-13T00:00:00.000 | AB18: =R[-1]C+1 -> 2026-01-13T00:00:00.000
A19: =R[-1]C+1 -> 2023-10-14T00:00:00.000 | B19: =R[-1]C+1 -> 2023-11-14T00:00:00.000 | C19: =R[-1]C+1 -> 2023-12-14T00:00:00.000 | D19: =R[-1]C+1 -> 2024-01-14T00:00:00.000 | E19: =R[-1]C+1 -> 2024-02-14T00:00:00.000 | F19: =R[-1]C+1 -> 2024-03-14T00:00:00.000 | G19: =R[-1]C+1 -> 2024-04-14T00:00:00.000 | H19: =R[-1]C+1 -> 2024-05-14T00:00:00.000 | I19: =R[-1]C+1 -> 2024-06-14T00:00:00.000 | J19: =R[-1]C+1 -> 2024-07-14T00:00:00.000 | K19: =R[-1]C+1 -> 2024-08-14T00:00:00.000 | L19: =R[-1]C+1 -> 2024-09-14T00:00:00.000 | M19: =R[-1]C+1 -> 2024-10-14T00:00:00.000 | N19: =R[-1]C+1 -> 2024-11-14T00:00:00.000 | O19: =R[-1]C+1 -> 2024-12-14T00:00:00.000 | P19: =R[-1]C+1 -> 2025-01-14T00:00:00.000 | Q19: =R[-1]C+1 -> 2025-02-14T00:00:00.000 | R19: =R[-1]C+1 -> 2025-03-14T00:00:00.000 | S19: =R[-1]C+1 -> 2025-04-14T00:00:00.000 | T19: =R[-1]C+1 -> 2025-05-14T00:00:00.000 | U19: =R[-1]C+1 -> 2025-06-14T00:00:00.000 | V19: =R[-1]C+1 -> 2025-07-14T00:00:00.000 | W19: =R[-1]C+1 -> 2025-08-14T00:00:00.000 | X19: =R[-1]C+1 -> 2025-09-14T00:00:00.000 | Y19: =R[-1]C+1 -> 2025-10-14T00:00:00.000 | Z19: =R[-1]C+1 -> 2025-11-14T00:00:00.000 | AA19: =R[-1]C+1 -> 2025-12-14T00:00:00.000 | AB19: =R[-1]C+1 -> 2026-01-14T00:00:00.000
A20: =R[-1]C+1 -> 2023-10-15T00:00:00.000 | B20: =R[-1]C+1 -> 2023-11-15T00:00:00.000 | C20: =R[-1]C+1 -> 2023-12-15T00:00:00.000 | D20: =R[-1]C+1 -> 2024-01-15T00:00:00.000 | E20: =R[-1]C+1 -> 2024-02-15T00:00:00.000 | F20: =R[-1]C+1 -> 2024-03-15T00:00:00.000 | G20: =R[-1]C+1 -> 2024-04-15T00:00:00.000 | H20: =R[-1]C+1 -> 2024-05-15T00:00:00.000 | I20: =R[-1]C+1 -> 2024-06-15T00:00:00.000 | J20: =R[-1]C+1 -> 2024-07-15T00:00:00.000 | K20: =R[-1]C+1 -> 2024-08-15T00:00:00.000 | L20: =R[-1]C+1 -> 2024-09-15T00:00:00.000 | M20: =R[-1]C+1 -> 2024-10-15T00:00:00.000 | N20: =R[-1]C+1 -> 2024-11-15T00:00:00.000 | O20: =R[-1]C+1 -> 2024-12-15T00:00:00.000 | P20: =R[-1]C+1 -> 2025-01-15T00:00:00.000 | Q20: =R[-1]C+1 -> 2025-02-15T00:00:00.000 | R20: =R[-1]C+1 -> 2025-03-15T00:00:00.000 | S20: =R[-1]C+1 -> 2025-04-15T00:00:00.000 | T20: =R[-1]C+1 -> 2025-05-15T00:00:00.000 | U20: =R[-1]C+1 -> 2025-06-15T00:00:00.000 | V20: =R[-1]C+1 -> 2025-07-15T00:00:00.000 | W20: =R[-1]C+1 -> 2025-08-15T00:00:00.000 | X20: =R[-1]C+1 -> 2025-09-15T00:00:00.000 | Y20: =R[-1]C+1 -> 2025-10-15T00:00:00.000 | Z20: =R[-1]C+1 -> 2025-11-15T00:00:00.000 | AA20: =R[-1]C+1 -> 2025-12-15T00:00:00.000 | AB20: =R[-1]C+1 -> 2026-01-15T00:00:00.000
A21: =R[-1]C+1 -> 2023-10-16T00:00:00.000 | B21: =R[-1]C+1 -> 2023-11-16T00:00:00.000 | C21: =R[-1]C+1 -> 2023-12-16T00:00:00.000 | D21: =R[-1]C+1 -> 2024-01-16T00:00:00.000 | E21: =R[-1]C+1 -> 2024-02-16T00:00:00.000 | F21: =R[-1]C+1 -> 2024-03-16T00:00:00.000 | G21: =R[-1]C+1 -> 2024-04-16T00:00:00.000 | H21: =R[-1]C+1 -> 2024-05-16T00:00:00.000 | I21: =R[-1]C+1 -> 2024-06-16T00:00:00.000 | J21: =R[-1]C+1 -> 2024-07-16T00:00:00.000 | K21: =R[-1]C+1 -> 2024-08-16T00:00:00.000 | L21: =R[-1]C+1 -> 2024-09-16T00:00:00.000 | M21: =R[-1]C+1 -> 2024-10-16T00:00:00.000 | N21: =R[-1]C+1 -> 2024-11-16T00:00:00.000 | O21: =R[-1]C+1 -> 2024-12-16T00:00:00.000 | P21: =R[-1]C+1 -> 2025-01-16T00:00:00.000 | Q21: =R[-1]C+1 -> 2025-02-16T00:00:00.000 | R21: =R[-1]C+1 -> 2025-03-16T00:00:00.000 | S21: =R[-1]C+1 -> 2025-04-16T00:00:00.000 | T21: =R[-1]C+1 -> 2025-05-16T00:00:00.000 | U21: =R[-1]C+1 -> 2025-06-16T00:00:00.000 | V21: =R[-1]C+1 -> 2025-07-16T00:00:00.000 | W21: =R[-1]C+1 -> 2025-08-16T00:00:00.000 | X21: =R[-1]C+1 -> 2025-09-16T00:00:00.000 | Y21: =R[-1]C+1 -> 2025-10-16T00:00:00.000 | Z21: =R[-1]C+1 -> 2025-11-16T00:00:00.000 | AA21: =R[-1]C+1 -> 2025-12-16T00:00:00.000 | AB21: =R[-1]C+1 -> 2026-01-16T00:00:00.000
A22: =R[-1]C+1 -> 2023-10-17T00:00:00.000 | B22: =R[-1]C+1 -> 2023-11-17T00:00:00.000 | C22: =R[-1]C+1 -> 2023-12-17T00:00:00.000 | D22: =R[-1]C+1 -> 2024-01-17T00:00:00.000 | E22: =R[-1]C+1 -> 2024-02-17T00:00:00.000 | F22: =R[-1]C+1 -> 2024-03-17T00:00:00.000 | G22: =R[-1]C+1 -> 2024-04-17T00:00:00.000 | H22: =R[-1]C+1 -> 2024-05-17T00:00:00.000 | I22: =R[-1]C+1 -> 2024-06-17T00:00:00.000 | J22: =R[-1]C+1 -> 2024-07-17T00:00:00.000 | K22: =R[-1]C+1 -> 2024-08-17T00:00:00.000 | L22: =R[-1]C+1 -> 2024-09-17T00:00:00.000 | M22: =R[-1]C+1 -> 2024-10-17T00:00:00.000 | N22: =R[-1]C+1 -> 2024-11-17T00:00:00.000 | O22: =R[-1]C+1 -> 2024-12-17T00:00:00.000 | P22: =R[-1]C+1 -> 2025-01-17T00:00:00.000 | Q22: =R[-1]C+1 -> 2025-02-17T00:00:00.000 | R22: =R[-1]C+1 -> 2025-03-17T00:00:00.000 | S22: =R[-1]C+1 -> 2025-04-17T00:00:00.000 | T22: =R[-1]C+1 -> 2025-05-17T00:00:00.000 | U22: =R[-1]C+1 -> 2025-06-17T00:00:00.000 | V22: =R[-1]C+1 -> 2025-07-17T00:00:00.000 | W22: =R[-1]C+1 -> 2025-08-17T00:00:00.000 | X22: =R[-1]C+1 -> 2025-09-17T00:00:00.000 | Y22: =R[-1]C+1 -> 2025-10-17T00:00:00.000 | Z22: =R[-1]C+1 -> 2025-11-17T00:00:00.000 | AA22: =R[-1]C+1 -> 2025-12-17T00:00:00.000 | AB22: =R[-1]C+1 -> 2026-01-17T00:00:00.000
A23: =R[-1]C+1 -> 2023-10-18T00:00:00.000 | B23: =R[-1]C+1 -> 2023-11-18T00:00:00.000 | C23: =R[-1]C+1 -> 2023-12-18T00:00:00.000 | D23: =R[-1]C+1 -> 2024-01-18T00:00:00.000 | E23: =R[-1]C+1 -> 2024-02-18T00:00:00.000 | F23: =R[-1]C+1 -> 2024-03-18T00:00:00.000 | G23: =R[-1]C+1 -> 2024-04-18T00:00:00.000 | H23: =R[-1]C+1 -> 2024-05-18T00:00:00.000 | I23: =R[-1]C+1 -> 2024-06-18T00:00:00.000 | J23: =R[-1]C+1 -> 2024-07-18T00:00:00.000 | K23: =R[-1]C+1 -> 2024-08-18T00:00:00.000 | L23: =R[-1]C+1 -> 2024-09-18T00:00:00.000 | M23: =R[-1]C+1 -> 2024-10-18T00:00:00.000 | N23: =R[-1]C+1 -> 2024-11-18T00:00:00.000 | O23: =R[-1]C+1 -> 2024-12-18T00:00:00.000 | P23: =R[-1]C+1 -> 2025-01-18T00:00:00.000 | Q23: =R[-1]C+1 -> 2025-02-18T00:00:00.000 | R23: =R[-1]C+1 -> 2025-03-18T00:00:00.000 | S23: =R[-1]C+1 -> 2025-04-18T00:00:00.000 | T23: =R[-1]C+1 -> 2025-05-18T00:00:00.000 | U23: =R[-1]C+1 -> 2025-06-18T00:00:00.000 | V23: =R[-1]C+1 -> 2025-07-18T00:00:00.000 | W23: =R[-1]C+1 -> 2025-08-18T00:00:00.000 | X23: =R[-1]C+1 -> 2025-09-18T00:00:00.000 | Y23: =R[-1]C+1 -> 2025-10-18T00:00:00.000 | Z23: =R[-1]C+1 -> 2025-11-18T00:00:00.000 | AA23: =R[-1]C+1 -> 2025-12-18T00:00:00.000 | AB23: =R[-1]C+1 -> 2026-01-18T00:00:00.000
A24: =R[-1]C+1 -> 2023-10-19T00:00:00.000 | B24: =R[-1]C+1 -> 2023-11-19T00:00:00.000 | C24: =R[-1]C+1 -> 2023-12-19T00:00:00.000 | D24: =R[-1]C+1 -> 2024-01-19T00:00:00.000 | E24: =R[-1]C+1 -> 2024-02-19T00:00:00.000 | F24: =R[-1]C+1 -> 2024-03-19T00:00:00.000 | G24: =R[-1]C+1 -> 2024-04-19T00:00:00.000 | H24: =R[-1]C+1 -> 2024-05-19T00:00:00.000 | I24: =R[-1]C+1 -> 2024-06-19T00:00:00.000 | J24: =R[-1]C+1 -> 2024-07-19T00:00:00.000 | K24: =R[-1]C+1 -> 2024-08-19T00:00:00.000 | L24: =R[-1]C+1 -> 2024-09-19T00:00:00.000 | M24: =R[-1]C+1 -> 2024-10-19T00:00:00.000 | N24: =R[-1]C+1 -> 2024-11-19T00:00:00.000 | O24: =R[-1]C+1 -> 2024-12-19T00:00:00.000 | P24: =R[-1]C+1 -> 2025-01-19T00:00:00.000 | Q24: =R[-1]C+1 -> 2025-02-19T00:00:00.000 | R24: =R[-1]C+1 -> 2025-03-19T00:00:00.000 | S24: =R[-1]C+1 -> 2025-04-19T00:00:00.000 | T24: =R[-1]C+1 -> 2025-05-19T00:00:00.000 | U24: =R[-1]C+1 -> 2025-06-19T00:00:00.000 | V24: =R[-1]C+1 -> 2025-07-19T00:00:00.000 | W24: =R[-1]C+1 -> 2025-08-19T00:00:00.000 | X24: =R[-1]C+1 -> 2025-09-19T00:00:00.000 | Y24: =R[-1]C+1 -> 2025-10-19T00:00:00.000 | Z24: =R[-1]C+1 -> 2025-11-19T00:00:00.000 | AA24: =R[-1]C+1 -> 2025-12-19T00:00:00.000 | AB24: =R[-1]C+1 -> 2026-01-19T00:00:00.000
A25: =R[-1]C+1 -> 2023-10-20T00:00:00.000 | B25: =R[-1]C+1 -> 2023-11-20T00:00:00.000 | C25: =R[-1]C+1 -> 2023-12-20T00:00:00.000 | D25: =R[-1]C+1 -> 2024-01-20T00:00:00.000 | E25: =R[-1]C+1 -> 2024-02-20T00:00:00.000 | F25: =R[-1]C+1 -> 2024-03-20T00:00:00.000 | G25: =R[-1]C+1 -> 2024-04-20T00:00:00.000 | H25: =R[-1]C+1 -> 2024-05-20T00:00:00.000 | I25: =R[-1]C+1 -> 2024-06-20T00:00:00.000 | J25: =R[-1]C+1 -> 2024-07-20T00:00:00.000 | K25: =R[-1]C+1 -> 2024-08-20T00:00:00.000 | L25: =R[-1]C+1 -> 2024-09-20T00:00:00.000 | M25: =R[-1]C+1 -> 2024-10-20T00:00:00.000 | N25: =R[-1]C+1 -> 2024-11-20T00:00:00.000 | O25: =R[-1]C+1 -> 2024-12-20T00:00:00.000 | P25: =R[-1]C+1 -> 2025-01-20T00:00:00.000 | Q25: =R[-1]C+1 -> 2025-02-20T00:00:00.000 | R25: =R[-1]C+1 -> 2025-03-20T00:00:00.000 | S25: =R[-1]C+1 -> 2025-04-20T00:00:00.000 | T25: =R[-1]C+1 -> 2025-05-20T00:00:00.000 | U25: =R[-1]C+1 -> 2025-06-20T00:00:00.000 | V25: =R[-1]C+1 -> 2025-07-20T00:00:00.000 | W25: =R[-1]C+1 -> 2025-08-20T00:00:00.000 | X25: =R[-1]C+1 -> 2025-09-20T00:00:00.000 | Y25: =R[-1]C+1 -> 2025-10-20T00:00:00.000 | Z25: =R[-1]C+1 -> 2025-11-20T00:00:00.000 | AA25: =R[-1]C+1 -> 2025-12-20T00:00:00.000 | AB25: =R[-1]C+1 -> 2026-01-20T00:00:00.000
A26: =R[-1]C+1 -> 2023-10-21T00:00:00.000 | B26: =R[-1]C+1 -> 2023-11-21T00:00:00.000 | C26: =R[-1]C+1 -> 2023-12-21T00:00:00.000 | D26: =R[-1]C+1 -> 2024-01-21T00:00:00.000 | E26: =R[-1]C+1 -> 2024-02-21T00:00:00.000 | F26: =R[-1]C+1 -> 2024-03-21T00:00:00.000 | G26: =R[-1]C+1 -> 2024-04-21T00:00:00.000 | H26: =R[-1]C+1 -> 2024-05-21T00:00:00.000 | I26: =R[-1]C+1 -> 2024-06-21T00:00:00.000 | J26: =R[-1]C+1 -> 2024-07-21T00:00:00.000 | K26: =R[-1]C+1 -> 2024-08-21T00:00:00.000 | L26: =R[-1]C+1 -> 2024-09-21T00:00:00.000 | M26: =R[-1]C+1 -> 2024-10-21T00:00:00.000 | N26: =R[-1]C+1 -> 2024-11-21T00:00:00.000 | O26: =R[-1]C+1 -> 2024-12-21T00:00:00.000 | P26: =R[-1]C+1 -> 2025-01-21T00:00:00.000 | Q26: =R[-1]C+1 -> 2025-02-21T00:00:00.000 | R26: =R[-1]C+1 -> 2025-03-21T00:00:00.000 | S26: =R[-1]C+1 -> 2025-04-21T00:00:00.000 | T26: =R[-1]C+1 -> 2025-05-21T00:00:00.000 | U26: =R[-1]C+1 -> 2025-06-21T00:00:00.000 | V26: =R[-1]C+1 -> 2025-07-21T00:00:00.000 | W26: =R[-1]C+1 -> 2025-08-21T00:00:00.000 | X26: =R[-1]C+1 -> 2025-09-21T00:00:00.000 | Y26: =R[-1]C+1 -> 2025-10-21T00:00:00.000 | Z26: =R[-1]C+1 -> 2025-11-21T00:00:00.000 | AA26: =R[-1]C+1 -> 2025-12-21T00:00:00.000 | AB26: =R[-1]C+1 -> 2026-01-21T00:00:00.000
A27: =R[-1]C+1 -> 2023-10-22T00:00:00.000 | B27: =R[-1]C+1 -> 2023-11-22T00:00:00.000 | C27: =R[-1]C+1 -> 2023-12-22T00:00:00.000 | D27: =R[-1]C+1 -> 2024-01-22T00:00:00.000 | E27: =R[-1]C+1 -> 2024-02-22T00:00:00.000 | F27: =R[-1]C+1 -> 2024-03-22T00:00:00.000 | G27: =R[-1]C+1 -> 2024-04-22T00:00:00.000 | H27: =R[-1]C+1 -> 2024-05-22T00:00:00.000 | I27: =R[-1]C+1 -> 2024-06-22T00:00:00.000 | J27: =R[-1]C+1 -> 2024-07-22T00:00:00.000 | K27: =R[-1]C+1 -> 2024-08-22T00:00:00.000 | L27: =R[-1]C+1 -> 2024-09-22T00:00:00.000 | M27: =R[-1]C+1 -> 2024-10-22T00:00:00.000 | N27: =R[-1]C+1 -> 2024-11-22T00:00:00.000 | O27: =R[-1]C+1 -> 2024-12-22T00:00:00.000 | P27: =R[-1]C+1 -> 2025-01-22T00:00:00.000 | Q27: =R[-1]C+1 -> 2025-02-22T00:00:00.000 | R27: =R[-1]C+1 -> 2025-03-22T00:00:00.000 | S27: =R[-1]C+1 -> 2025-04-22T00:00:00.000 | T27: =R[-1]C+1 -> 2025-05-22T00:00:00.000 | U27: =R[-1]C+1 -> 2025-06-22T00:00:00.000 | V27: =R[-1]C+1 -> 2025-07-22T00:00:00.000 | W27: =R[-1]C+1 -> 2025-08-22T00:00:00.000 | X27: =R[-1]C+1 -> 2025-09-22T00:00:00.000 | Y27: =R[-1]C+1 -> 2025-10-22T00:00:00.000 | Z27: =R[-1]C+1 -> 2025-11-22T00:00:00.000 | AA27: =R[-1]C+1 -> 2025-12-22T00:00:00.000 | AB27: =R[-1]C+1 -> 2026-01-22T00:00:00.000
A28: =R[-1]C+1 -> 2023-10-23T00:00:00.000 | B28: =R[-1]C+1 -> 2023-11-23T00:00:00.000 | C28: =R[-1]C+1 -> 2023-12-23T00:00:00.000 | D28: =R[-1]C+1 -> 2024-01-23T00:00:00.000 | E28: =R[-1]C+1 -> 2024-02-23T00:00:00.000 | F28: =R[-1]C+1 -> 2024-03-23T00:00:00.000 | G28: =R[-1]C+1 -> 2024-04-23T00:00:00.000 | H28: =R[-1]C+1 -> 2024-05-23T00:00:00.000 | I28: =R[-1]C+1 -> 2024-06-23T00:00:00.000 | J28: =R[-1]C+1 -> 2024-07-23T00:00:00.000 | K28: =R[-1]C+1 -> 2024-08-23T00:00:00.000 | L28: =R[-1]C+1 -> 2024-09-23T00:00:00.000 | M28: =R[-1]C+1 -> 2024-10-23T00:00:00.000 | N28: =R[-1]C+1 -> 2024-11-23T00:00:00.000 | O28: =R[-1]C+1 -> 2024-12-23T00:00:00.000 | P28: =R[-1]C+1 -> 2025-01-23T00:00:00.000 | Q28: =R[-1]C+1 -> 2025-02-23T00:00:00.000 | R28: =R[-1]C+1 -> 2025-03-23T00:00:00.000 | S28: =R[-1]C+1 -> 2025-04-23T00:00:00.000 | T28: =R[-1]C+1 -> 2025-05-23T00:00:00.000 | U28: =R[-1]C+1 -> 2025-06-23T00:00:00.000 | V28: =R[-1]C+1 -> 2025-07-23T00:00:00.000 | W28: =R[-1]C+1 -> 2025-08-23T00:00:00.000 | X28: =R[-1]C+1 -> 2025-09-23T00:00:00.000 | Y28: =R[-1]C+1 -> 2025-10-23T00:00:00.000 | Z28: =R[-1]C+1 -> 2025-11-23T00:00:00.000 | AA28: =R[-1]C+1 -> 2025-12-23T00:00:00.000 | AB28: =R[-1]C+1 -> 2026-01-23T00:00:00.000
A29: =R[-1]C+1 -> 2023-10-24T00:00:00.000 | B29: =R[-1]C+1 -> 2023-11-24T00:00:00.000 | C29: =R[-1]C+1 -> 2023-12-24T00:00:00.000 | D29: =R[-1]C+1 -> 2024-01-24T00:00:00.000 | E29: =R[-1]C+1 -> 2024-02-24T00:00:00.000 | F29: =R[-1]C+1 -> 2024-03-24T00:00:00.000 | G29: =R[-1]C+1 -> 2024-04-24T00:00:00.000 | H29: =R[-1]C+1 -> 2024-05-24T00:00:00.000 | I29: =R[-1]C+1 -> 2024-06-24T00:00:00.000 | J29: =R[-1]C+1 -> 2024-07-24T00:00:00.000 | K29: =R[-1]C+1 -> 2024-08-24T00:00:00.000 | L29: =R[-1]C+1 -> 2024-09-24T00:00:00.000 | M29: =R[-1]C+1 -> 2024-10-24T00:00:00.000 | N29: =R[-1]C+1 -> 2024-11-24T00:00:00.000 | O29: =R[-1]C+1 -> 2024-12-24T00:00:00.000 | P29: =R[-1]C+1 -> 2025-01-24T00:00:00.000 | Q29: =R[-1]C+1 -> 2025-02-24T00:00:00.000 | R29: =R[-1]C+1 -> 2025-03-24T00:00:00.000 | S29: =R[-1]C+1 -> 2025-04-24T00:00:00.000 | T29: =R[-1]C+1 -> 2025-05-24T00:00:00.000 | U29: =R[-1]C+1 -> 2025-06-24T00:00:00.000 | V29: =R[-1]C+1 -> 2025-07-24T00:00:00.000 | W29: =R[-1]C+1 -> 2025-08-24T00:00:00.000 | X29: =R[-1]C+1 -> 2025-09-24T00:00:00.000 | Y29: =R[-1]C+1 -> 2025-10-24T00:00:00.000 | Z29: =R[-1]C+1 -> 2025-11-24T00:00:00.000 | AA29: =R[-1]C+1 -> 2025-12-24T00:00:00.000 | AB29: =R[-1]C+1 -> 2026-01-24T00:00:00.000
A30: =R[-1]C+1 -> 2023-10-25T00:00:00.000 | B30: =R[-1]C+1 -> 2023-11-25T00:00:00.000 | C30: =R[-1]C+1 -> 2023-12-25T00:00:00.000 | D30: =R[-1]C+1 -> 2024-01-25T00:00:00.000 | E30: =R[-1]C+1 -> 2024-02-25T00:00:00.000 | F30: =R[-1]C+1 -> 2024-03-25T00:00:00.000 | G30: =R[-1]C+1 -> 2024-04-25T00:00:00.000 | H30: =R[-1]C+1 -> 2024-05-25T00:00:00.000 | I30: =R[-1]C+1 -> 2024-06-25T00:00:00.000 | J30: =R[-1]C+1 -> 2024-07-25T00:00:00.000 | K30: =R[-1]C+1 -> 2024-08-25T00:00:00.000 | L30: =R[-1]C+1 -> 2024-09-25T00:00:00.000 | M30: =R[-1]C+1 -> 2024-10-25T00:00:00.000 | N30: =R[-1]C+1 -> 2024-11-25T00:00:00.000 | O30: =R[-1]C+1 -> 2024-12-25T00:00:00.000 | P30: =R[-1]C+1 -> 2025-01-25T00:00:00.000 | Q30: =R[-1]C+1 -> 2025-02-25T00:00:00.000 | R30: =R[-1]C+1 -> 2025-03-25T00:00:00.000 | S30: =R[-1]C+1 -> 2025-04-25T00:00:00.000 | T30: =R[-1]C+1 -> 2025-05-25T00:00:00.000 | U30: =R[-1]C+1 -> 2025-06-25T00:00:00.000 | V30: =R[-1]C+1 -> 2025-07-25T00:00:00.000 | W30: =R[-1]C+1 -> 2025-08-25T00:00:00.000 | X30: =R[-1]C+1 -> 2025-09-25T00:00:00.000 | Y30: =R[-1]C+1 -> 2025-10-25T00:00:00.000 | Z30: =R[-1]C+1 -> 2025-11-25T00:00:00.000 | AA30: =R[-1]C+1 -> 2025-12-25T00:00:00.000 | AB30: =R[-1]C+1 -> 2026-01-25T00:00:00.000
A31: =R[-1]C+1 -> 2023-10-26T00:00:00.000 | B31: =R[-1]C+1 -> 2023-11-26T00:00:00.000 | C31: =R[-1]C+1 -> 2023-12-26T00:00:00.000 | D31: =R[-1]C+1 -> 2024-01-26T00:00:00.000 | E31: =R[-1]C+1 -> 2024-02-26T00:00:00.000 | F31: =R[-1]C+1 -> 2024-03-26T00:00:00.000 | G31: =R[-1]C+1 -> 2024-04-26T00:00:00.000 | H31: =R[-1]C+1 -> 2024-05-26T00:00:00.000 | I31: =R[-1]C+1 -> 2024-06-26T00:00:00.000 | J31: =R[-1]C+1 -> 2024-07-26T00:00:00.000 | K31: =R[-1]C+1 -> 2024-08-26T00:00:00.000 | L31: =R[-1]C+1 -> 2024-09-26T00:00:00.000 | M31: =R[-1]C+1 -> 2024-10-26T00:00:00.000 | N31: =R[-1]C+1 -> 2024-11-26T00:00:00.000 | O31: =R[-1]C+1 -> 2024-12-26T00:00:00.000 | P31: =R[-1]C+1 -> 2025-01-26T00:00:00.000 | Q31: =R[-1]C+1 -> 2025-02-26T00:00:00.000 | R31: =R[-1]C+1 -> 2025-03-26T00:00:00.000 | S31: =R[-1]C+1 -> 2025-04-26T00:00:00.000 | T31: =R[-1]C+1 -> 2025-05-26T00:00:00.000 | U31: =R[-1]C+1 -> 2025-06-26T00:00:00.000 | V31: =R[-1]C+1 -> 2025-07-26T00:00:00.000 | W31: =R[-1]C+1 -> 2025-08-26T00:00:00.000 | X31: =R[-1]C+1 -> 2025-09-26T00:00:00.000 | Y31: =R[-1]C+1 -> 2025-10-26T00:00:00.000 | Z31: =R[-1]C+1 -> 2025-11-26T00:00:00.000 | AA31: =R[-1]C+1 -> 2025-12-26T00:00:00.000 | AB31: =R[-1]C+1 -> 2026-01-26T00:00:00.000
A32: =IFERROR(IF(MONTH(R[-1]C+1)<>MONTH(R[-1]C),"",R[-1]C+1),"") -> 2023-10-27T00:00:00.000 | B32: =IFERROR(IF(MONTH(R[-1]C+1)<>MONTH(R[-1]C),"",R[-1]C+1),"") -> 2023-11-27T00:00:00.000 | C32: =IFERROR(IF(MONTH(R[-1]C+1)<>MONTH(R[-1]C),"",R[-1]C+1),"") -> 2023-12-27T00:00:00.000 | D32: =IFERROR(IF(MONTH(R[-1]C+1)<>MONTH(R[-1]C),"",R[-1]C+1),"") -> 2024-01-27T00:00:00.000 | E32: =IFERROR(IF(MONTH(R[-1]C+1)<>MONTH(R[-1]C),"",R[-1]C+1),"") -> 2024-02-27T00:00:00.000 | F32: =IFERROR(IF(MONTH(R[-1]C+1)<>MONTH(R[-1]C),"",R[-1]C+1),"") -> 2024-03-27T00:00:00.000 | G32: =IFERROR(IF(MONTH(R[-1]C+1)<>MONTH(R[-1]C),"",R[-1]C+1),"") -> 2024-04-27T00:00:00.000 | H32: =IFERROR(IF(MONTH(R[-1]C+1)<>MONTH(R[-1]C),"",R[-1]C+1),"") -> 2024-05-27T00:00:00.000 | I32: =IFERROR(IF(MONTH(R[-1]C+1)<>MONTH(R[-1]C),"",R[-1]C+1),"") -> 2024-06-27T00:00:00.000 | J32: =IFERROR(IF(MONTH(R[-1]C+1)<>MONTH(R[-1]C),"",R[-1]C+1),"") -> 2024-07-27T00:00:00.000 | K32: =IFERROR(IF(MONTH(R[-1]C+1)<>MONTH(R[-1]C),"",R[-1]C+1),"") -> 2024-08-27T00:00:00.000 | L32: =IFERROR(IF(MONTH(R[-1]C+1)<>MONTH(R[-1]C),"",R[-1]C+1),"") -> 2024-09-27T00:00:00.000 | M32: =IFERROR(IF(MONTH(R[-1]C+1)<>MONTH(R[-1]C),"",R[-1]C+1),"") -> 2024-10-27T00:00:00.000 | N32: =IFERROR(IF(MONTH(R[-1]C+1)<>MONTH(R[-1]C),"",R[-1]C+1),"") -> 2024-11-27T00:00:00.000 | O32: =IFERROR(IF(MONTH(R[-1]C+1)<>MONTH(R[-1]C),"",R[-1]C+1),"") -> 2024-12-27T00:00:00.000 | P32: =IFERROR(IF(MONTH(R[-1]C+1)<>MONTH(R[-1]C),"",R[-1]C+1),"") -> 2025-01-27T00:00:00.000 | Q32: =IFERROR(IF(MONTH(R[-1]C+1)<>MONTH(R[-1]C),"",R[-1]C+1),"") -> 2025-02-27T00:00:00.000 | R32: =IFERROR(IF(MONTH(R[-1]C+1)<>MONTH(R[-1]C),"",R[-1]C+1),"") -> 2025-03-27T00:00:00.000 | S32: =IFERROR(IF(MONTH(R[-1]C+1)<>MONTH(R[-1]C),"",R[-1]C+1),"") -> 2025-04-27T00:00:00.000 | T32: =IFERROR(IF(MONTH(R[-1]C+1)<>MONTH(R[-1]C),"",R[-1]C+1),"") -> 2025-05-27T00:00:00.000 | U32: =IFERROR(IF(MONTH(R[-1]C+1)<>MONTH(R[-1]C),"",R[-1]C+1),"") -> 2025-06-27T00:00:00.000 | V32: =IFERROR(IF(MONTH(R[-1]C+1)<>MONTH(R[-1]C),"",R[-1]C+1),"") -> 2025-07-27T00:00:00.000 | W32: =IFERROR(IF(MONTH(R[-1]C+1)<>MONTH(R[-1]C),"",R[-1]C+1),"") -> 2025-08-27T00:00:00.000 | X32: =IFERROR(IF(MONTH(R[-1]C+1)<>MONTH(R[-1]C),"",R[-1]C+1),"") -> 2025-09-27T00:00:00.000 | Y32: =IFERROR(IF(MONTH(R[-1]C+1)<>MONTH(R[-1]C),"",R[-1]C+1),"") -> 2025-10-27T00:00:00.000 | Z32: =IFERROR(IF(MONTH(R[-1]C+1)<>MONTH(R[-1]C),"",R[-1]C+1),"") -> 2025-11-27T00:00:00.000 | AA32: =IFERROR(IF(MONTH(R[-1]C+1)<>MONTH(R[-1]C),"",R[-1]C+1),"") -> 2025-12-27T00:00:00.000 | AB32: =IFERROR(IF(MONTH(R[-1]C+1)<>MONTH(R[-1]C),"",R[-1]C+1),"") -> 2026-01-27T00:00:00.000
A33: =IFERROR(IF(MONTH(R[-1]C+1)<>MONTH(R[-1]C),"",R[-1]C+1),"") -> 2023-10-28T00:00:00.000 | B33: =IFERROR(IF(MONTH(R[-1]C+1)<>MONTH(R[-1]C),"",R[-1]C+1),"") -> 2023-11-28T00:00:00.000 | C33: =IFERROR(IF(MONTH(R[-1]C+1)<>MONTH(R[-1]C),"",R[-1]C+1),"") -> 2023-12-28T00:00:00.000 | D33: =IFERROR(IF(MONTH(R[-1]C+1)<>MONTH(R[-1]C),"",R[-1]C+1),"") -> 2024-01-28T00:00:00.000 | E33: =IFERROR(IF(MONTH(R[-1]C+1)<>MONTH(R[-1]C),"",R[-1]C+1),"") -> 2024-02-28T00:00:00.000 | F33: =IFERROR(IF(MONTH(R[-1]C+1)<>MONTH(R[-1]C),"",R[-1]C+1),"") -> 2024-03-28T00:00:00.000 | G33: =IFERROR(IF(MONTH(R[-1]C+1)<>MONTH(R[-1]C),"",R[-1]C+1),"") -> 2024-04-28T00:00:00.000 | H33: =IFERROR(IF(MONTH(R[-1]C+1)<>MONTH(R[-1]C),"",R[-1]C+1),"") -> 2024-05-28T00:00:00.000 | I33: =IFERROR(IF(MONTH(R[-1]C+1)<>MONTH(R[-1]C),"",R[-1]C+1),"") -> 2024-06-28T00:00:00.000 | J33: =IFERROR(IF(MONTH(R[-1]C+1)<>MONTH(R[-1]C),"",R[-1]C+1),"") -> 2024-07-28T00:00:00.000 | K33: =IFERROR(IF(MONTH(R[-1]C+1)<>MONTH(R[-1]C),"",R[-1]C+1),"") -> 2024-08-28T00:00:00.000 | L33: =IFERROR(IF(MONTH(R[-1]C+1)<>MONTH(R[-1]C),"",R[-1]C+1),"") -> 2024-09-28T00:00:00.000 | M33: =IFERROR(IF(MONTH(R[-1]C+1)<>MONTH(R[-1]C),"",R[-1]C+1),"") -> 2024-10-28T00:00:00.000 | N33: =IFERROR(IF(MONTH(R[-1]C+1)<>MONTH(R[-1]C),"",R[-1]C+1),"") -> 2024-11-28T00:00:00.000 | O33: =IFERROR(IF(MONTH(R[-1]C+1)<>MONTH(R[-1]C),"",R[-1]C+1),"") -> 2024-12-28T00:00:00.000 | P33: =IFERROR(IF(MONTH(R[-1]C+1)<>MONTH(R[-1]C),"",R[-1]C+1),"") -> 2025-01-28T00:00:00.000 | Q33: =IFERROR(IF(MONTH(R[-1]C+1)<>MONTH(R[-1]C),"",R[-1]C+1),"") -> 2025-02-28T00:00:00.000 | R33: =IFERROR(IF(MONTH(R[-1]C+1)<>MONTH(R[-1]C),"",R[-1]C+1),"") -> 2025-03-28T00:00:00.000 | S33: =IFERROR(IF(MONTH(R[-1]C+1)<>MONTH(R[-1]C),"",R[-1]C+1),"") -> 2025-04-28T00:00:00.000 | T33: =IFERROR(IF(MONTH(R[-1]C+1)<>MONTH(R[-1]C),"",R[-1]C+1),"") -> 2025-05-28T00:00:00.000 | U33: =IFERROR(IF(MONTH(R[-1]C+1)<>MONTH(R[-1]C),"",R[-1]C+1),"") -> 2025-06-28T00:00:00.000 | V33: =IFERROR(IF(MONTH(R[-1]C+1)<>MONTH(R[-1]C),"",R[-1]C+1),"") -> 2025-07-28T00:00:00.000 | W33: =IFERROR(IF(MONTH(R[-1]C+1)<>MONTH(R[-1]C),"",R[-1]C+1),"") -> 2025-08-28T00:00:00.000 | X33: =IFERROR(IF(MONTH(R[-1]C+1)<>MONTH(R[-1]C),"",R[-1]C+1),"") -> 2025-09-28T00:00:00.000 | Y33: =IFERROR(IF(MONTH(R[-1]C+1)<>MONTH(R[-1]C),"",R[-1]C+1),"") -> 2025-10-28T00:00:00.000 | Z33: =IFERROR(IF(MONTH(R[-1]C+1)<>MONTH(R[-1]C),"",R[-1]C+1),"") -> 2025-11-28T00:00:00.000 | AA33: =IFERROR(IF(MONTH(R[-1]C+1)<>MONTH(R[-1]C),"",R[-1]C+1),"") -> 2025-12-28T00:00:00.000 | AB33: =IFERROR(IF(MONTH(R[-1]C+1)<>MONTH(R[-1]C),"",R[-1]C+1),"") -> 2026-01-28T00:00:00.000
A34: =IFERROR(IF(MONTH(R[-1]C+1)<>MONTH(R[-1]C),"",R[-1]C+1),"") -> 2023-10-29T00:00:00.000 | B34: =IFERROR(IF(MONTH(R[-1]C+1)<>MONTH(R[-1]C),"",R[-1]C+1),"") -> 2023-11-29T00:00:00.000 | C34: =IFERROR(IF(MONTH(R[-1]C+1)<>MONTH(R[-1]C),"",R[-1]C+1),"") -> 2023-12-29T00:00:00.000 | D34: =IFERROR(IF(MONTH(R[-1]C+1)<>MONTH(R[-1]C),"",R[-1]C+1),"") -> 2024-01-29T00:00:00.000 | E34: =IFERROR(IF(MONTH(R[-1]C+1)<>MONTH(R[-1]C),"",R[-1]C+1),"") -> 2024-02-29T00:00:00.000 | F34: =IFERROR(IF(MONTH(R[-1]C+1)<>MONTH(R[-1]C),"",R[-1]C+1),"") -> 2024-03-29T00:00:00.000 | G34: =IFERROR(IF(MONTH(R[-1]C+1)<>MONTH(R[-1]C),"",R[-1]C+1),"") -> 2024-04-29T00:00:00.000 | H34: =IFERROR(IF(MONTH(R[-1]C+1)<>MONTH(R[-1]C),"",R[-1]C+1),"") -> 2024-05-29T00:00:00.000 | I34: =IFERROR(IF(MONTH(R[-1]C+1)<>MONTH(R[-1]C),"",R[-1]C+1),"") -> 2024-06-29T00:00:00.000 | J34: =IFERROR(IF(MONTH(R[-1]C+1)<>MONTH(R[-1]C),"",R[-1]C+1),"") -> 2024-07-29T00:00:00.000 | K34: =IFERROR(IF(MONTH(R[-1]C+1)<>MONTH(R[-1]C),"",R[-1]C+1),"") -> 2024-08-29T00:00:00.000 | L34: =IFERROR(IF(MONTH(R[-1]C+1)<>MONTH(R[-1]C),"",R[-1]C+1),"") -> 2024-09-29T00:00:00.000 | M34: =IFERROR(IF(MONTH(R[-1]C+1)<>MONTH(R[-1]C),"",R[-1]C+1),"") -> 2024-10-29T00:00:00.000 | N34: =IFERROR(IF(MONTH(R[-1]C+1)<>MONTH(R[-1]C),"",R[-1]C+1),"") -> 2024-11-29T00:00:00.000 | O34: =IFERROR(IF(MONTH(R[-1]C+1)<>MONTH(R[-1]C),"",R[-1]C+1),"") -> 2024-12-29T00:00:00.000 | P34: =IFERROR(IF(MONTH(R[-1]C+1)<>MONTH(R[-1]C),"",R[-1]C+1),"") -> 2025-01-29T00:00:00.000 | Q34: =IFERROR(IF(MONTH(R[-1]C+1)<>MONTH(R[-1]C),"",R[-1]C+1),"") ->  | R34: =IFERROR(IF(MONTH(R[-1]C+1)<>MONTH(R[-1]C),"",R[-1]C+1),"") -> 2025-03-29T00:00:00.000 | S34: =IFERROR(IF(MONTH(R[-1]C+1)<>MONTH(R[-1]C),"",R[-1]C+1),"") -> 2025-04-29T00:00:00.000 | T34: =IFERROR(IF(MONTH(R[-1]C+1)<>MONTH(R[-1]C),"",R[-1]C+1),"") -> 2025-05-29T00:00:00.000 | U34: =IFERROR(IF(MONTH(R[-1]C+1)<>MONTH(R[-1]C),"",R[-1]C+1),"") -> 2025-06-29T00:00:00.000 | V34: =IFERROR(IF(MONTH(R[-1]C+1)<>MONTH(R[-1]C),"",R[-1]C+1),"") -> 2025-07-29T00:00:00.000 | W34: =IFERROR(IF(MONTH(R[-1]C+1)<>MONTH(R[-1]C),"",R[-1]C+1),"") -> 2025-08-29T00:00:00.000 | X34: =IFERROR(IF(MONTH(R[-1]C+1)<>MONTH(R[-1]C),"",R[-1]C+1),"") -> 2025-09-29T00:00:00.000 | Y34: =IFERROR(IF(MONTH(R[-1]C+1)<>MONTH(R[-1]C),"",R[-1]C+1),"") -> 2025-10-29T00:00:00.000 | Z34: =IFERROR(IF(MONTH(R[-1]C+1)<>MONTH(R[-1]C),"",R[-1]C+1),"") -> 2025-11-29T00:00:00.000 | AA34: =IFERROR(IF(MONTH(R[-1]C+1)<>MONTH(R[-1]C),"",R[-1]C+1),"") -> 2025-12-29T00:00:00.000 | AB34: =IFERROR(IF(MONTH(R[-1]C+1)<>MONTH(R[-1]C),"",R[-1]C+1),"") -> 2026-01-29T00:00:00.000
A35: =IFERROR(IF(MONTH(R[-1]C+1)<>MONTH(R[-1]C),"",R[-1]C+1),"") -> 2023-10-30T00:00:00.000 | B35: =IFERROR(IF(MONTH(R[-1]C+1)<>MONTH(R[-1]C),"",R[-1]C+1),"") -> 2023-11-30T00:00:00.000 | C35: =IFERROR(IF(MONTH(R[-1]C+1)<>MONTH(R[-1]C),"",R[-1]C+1),"") -> 2023-12-30T00:00:00.000 | D35: =IFERROR(IF(MONTH(R[-1]C+1)<>MONTH(R[-1]C),"",R[-1]C+1),"") -> 2024-01-30T00:00:00.000 | E35: =IFERROR(IF(MONTH(R[-1]C+1)<>MONTH(R[-1]C),"",R[-1]C+1),"") ->  | F35: =IFERROR(IF(MONTH(R[-1]C+1)<>MONTH(R[-1]C),"",R[-1]C+1),"") -> 2024-03-30T00:00:00.000 | G35: =IFERROR(IF(MONTH(R[-1]C+1)<>MONTH(R[-1]C),"",R[-1]C+1),"") -> 2024-04-30T00:00:00.000 | H35: =IFERROR(IF(MONTH(R[-1]C+1)<>MONTH(R[-1]C),"",R[-1]C+1),"") -> 2024-05-30T00:00:00.000 | I35: =IFERROR(IF(MONTH(R[-1]C+1)<>MONTH(R[-1]C),"",R[-1]C+1),"") -> 2024-06-30T00:00:00.000 | J35: =IFERROR(IF(MONTH(R[-1]C+1)<>MONTH(R[-1]C),"",R[-1]C+1),"") -> 2024-07-30T00:00:00.000 | K35: =IFERROR(IF(MONTH(R[-1]C+1)<>MONTH(R[-1]C),"",R[-1]C+1),"") -> 2024-08-30T00:00:00.000 | L35: =IFERROR(IF(MONTH(R[-1]C+1)<>MONTH(R[-1]C),"",R[-1]C+1),"") -> 2024-09-30T00:00:00.000 | M35: =IFERROR(IF(MONTH(R[-1]C+1)<>MONTH(R[-1]C),"",R[-1]C+1),"") -> 2024-10-30T00:00:00.000 | N35: =IFERROR(IF(MONTH(R[-1]C+1)<>MONTH(R[-1]C),"",R[-1]C+1),"") -> 2024-11-30T00:00:00.000 | O35: =IFERROR(IF(MONTH(R[-1]C+1)<>MONTH(R[-1]C),"",R[-1]C+1),"") -> 2024-12-30T00:00:00.000 | P35: =IFERROR(IF(MONTH(R[-1]C+1)<>MONTH(R[-1]C),"",R[-1]C+1),"") -> 2025-01-30T00:00:00.000 | Q35: =IFERROR(IF(MONTH(R[-1]C+1)<>MONTH(R[-1]C),"",R[-1]C+1),"") ->  | R35: =IFERROR(IF(MONTH(R[-1]C+1)<>MONTH(R[-1]C),"",R[-1]C+1),"") -> 2025-03-30T00:00:00.000 | S35: =IFERROR(IF(MONTH(R[-1]C+1)<>MONTH(R[-1]C),"",R[-1]C+1),"") -> 2025-04-30T00:00:00.000 | T35: =IFERROR(IF(MONTH(R[-1]C+1)<>MONTH(R[-1]C),"",R[-1]C+1),"") -> 2025-05-30T00:00:00.000 | U35: =IFERROR(IF(MONTH(R[-1]C+1)<>MONTH(R[-1]C),"",R[-1]C+1),"") -> 2025-06-30T00:00:00.000 | V35: =IFERROR(IF(MONTH(R[-1]C+1)<>MONTH(R[-1]C),"",R[-1]C+1),"") -> 2025-07-30T00:00:00.000 | W35: =IFERROR(IF(MONTH(R[-1]C+1)<>MONTH(R[-1]C),"",R[-1]C+1),"") -> 2025-08-30T00:00:00.000 | X35: =IFERROR(IF(MONTH(R[-1]C+1)<>MONTH(R[-1]C),"",R[-1]C+1),"") -> 2025-09-30T00:00:00.000 | Y35: =IFERROR(IF(MONTH(R[-1]C+1)<>MONTH(R[-1]C),"",R[-1]C+1),"") -> 2025-10-30T00:00:00.000 | Z35: =IFERROR(IF(MONTH(R[-1]C+1)<>MONTH(R[-1]C),"",R[-1]C+1),"") -> 2025-11-30T00:00:00.000 | AA35: =IFERROR(IF(MONTH(R[-1]C+1)<>MONTH(R[-1]C),"",R[-1]C+1),"") -> 2025-12-30T00:00:00.000 | AB35: =IFERROR(IF(MONTH(R[-1]C+1)<>MONTH(R[-1]C),"",R[-1]C+1),"") -> 2026-01-30T00:00:00.000
A36: =IFERROR(IF(MONTH(R[-1]C+1)<>MONTH(R[-1]C),"",R[-1]C+1),"") -> 2023-10-31T00:00:00.000 | B36: =IFERROR(IF(MONTH(R[-1]C+1)<>MONTH(R[-1]C),"",R[-1]C+1),"") ->  | C36: =IFERROR(IF(MONTH(R[-1]C+1)<>MONTH(R[-1]C),"",R[-1]C+1),"") -> 2023-12-31T00:00:00.000 | D36: =IFERROR(IF(MONTH(R[-1]C+1)<>MONTH(R[-1]C),"",R[-1]C+1),"") -> 2024-01-31T00:00:00.000 | E36: =IFERROR(IF(MONTH(R[-1]C+1)<>MONTH(R[-1]C),"",R[-1]C+1),"") ->  | F36: =IFERROR(IF(MONTH(R[-1]C+1)<>MONTH(R[-1]C),"",R[-1]C+1),"") -> 2024-03-31T00:00:00.000 | G36: =IFERROR(IF(MONTH(R[-1]C+1)<>MONTH(R[-1]C),"",R[-1]C+1),"") ->  | H36: =IFERROR(IF(MONTH(R[-1]C+1)<>MONTH(R[-1]C),"",R[-1]C+1),"") -> 2024-05-31T00:00:00.000 | I36: =IFERROR(IF(MONTH(R[-1]C+1)<>MONTH(R[-1]C),"",R[-1]C+1),"") ->  | J36: =IFERROR(IF(MONTH(R[-1]C+1)<>MONTH(R[-1]C),"",R[-1]C+1),"") -> 2024-07-31T00:00:00.000 | K36: =IFERROR(IF(MONTH(R[-1]C+1)<>MONTH(R[-1]C),"",R[-1]C+1),"") -> 2024-08-31T00:00:00.000 | L36: =IFERROR(IF(MONTH(R[-1]C+1)<>MONTH(R[-1]C),"",R[-1]C+1),"") ->  | M36: =IFERROR(IF(MONTH(R[-1]C+1)<>MONTH(R[-1]C),"",R[-1]C+1),"") -> 2024-10-31T00:00:00.000 | N36: =IFERROR(IF(MONTH(R[-1]C+1)<>MONTH(R[-1]C),"",R[-1]C+1),"") ->  | O36: =IFERROR(IF(MONTH(R[-1]C+1)<>MONTH(R[-1]C),"",R[-1]C+1),"") -> 2024-12-31T00:00:00.000 | P36: =IFERROR(IF(MONTH(R[-1]C+1)<>MONTH(R[-1]C),"",R[-1]C+1),"") -> 2025-01-31T00:00:00.000 | Q36: =IFERROR(IF(MONTH(R[-1]C+1)<>MONTH(R[-1]C),"",R[-1]C+1),"") ->  | R36: =IFERROR(IF(MONTH(R[-1]C+1)<>MONTH(R[-1]C),"",R[-1]C+1),"") -> 2025-03-31T00:00:00.000 | S36: =IFERROR(IF(MONTH(R[-1]C+1)<>MONTH(R[-1]C),"",R[-1]C+1),"") ->  | T36: =IFERROR(IF(MONTH(R[-1]C+1)<>MONTH(R[-1]C),"",R[-1]C+1),"") -> 2025-05-31T00:00:00.000 | U36: =IFERROR(IF(MONTH(R[-1]C+1)<>MONTH(R[-1]C),"",R[-1]C+1),"") ->  | V36: =IFERROR(IF(MONTH(R[-1]C+1)<>MONTH(R[-1]C),"",R[-1]C+1),"") -> 2025-07-31T00:00:00.000 | W36: =IFERROR(IF(MONTH(R[-1]C+1)<>MONTH(R[-1]C),"",R[-1]C+1),"") -> 2025-08-31T00:00:00.000 | X36: =IFERROR(IF(MONTH(R[-1]C+1)<>MONTH(R[-1]C),"",R[-1]C+1),"") ->  | Y36: =IFERROR(IF(MONTH(R[-1]C+1)<>MONTH(R[-1]C),"",R[-1]C+1),"") -> 2025-10-31T00:00:00.000 | Z36: =IFERROR(IF(MONTH(R[-1]C+1)<>MONTH(R[-1]C),"",R[-1]C+1),"") ->  | AA36: =IFERROR(IF(MONTH(R[-1]C+1)<>MONTH(R[-1]C),"",R[-1]C+1),"") -> 2025-12-31T00:00:00.000 | AB36: =IFERROR(IF(MONTH(R[-1]C+1)<>MONTH(R[-1]C),"",R[-1]C+1),"") -> 2026-01-31T00:00:00.000

Sheet: Leave
A1: 2023-08-07T00:00:00.000 | B1: 1 | C1: =RC[-2] -> 2023-08-07T00:00:00.000 | D1: =YEAR(RC[-3]) -> 2023 | E1: =IF(RC[-1]=Calendar!hols_year,Leave!RC[-3],0) -> 0
A2: 2023-08-08T00:00:00.000 | B2: 1 | C2: =RC[-2] -> 2023-08-08T00:00:00.000 | D2: =YEAR(RC[-3]) -> 2023 | E2: =IF(RC[-1]=Calendar!hols_year,Leave!RC[-3],0) -> 0
A3: 2023-08-09T00:00:00.000 | B3: 1 | C3: =RC[-2] -> 2023-08-09T00:00:00.000 | D3: =YEAR(RC[-3]) -> 2023 | E3: =IF(RC[-1]=Calendar!hols_year,Leave!RC[-3],0) -> 0
A4: 2023-08-10T00:00:00.000 | B4: 1 | C4: =RC[-2] -> 2023-08-10T00:00:00.000 | D4: =YEAR(RC[-3]) -> 2023 | E4: =IF(RC[-1]=Calendar!hols_year,Leave!RC[-3],0) -> 0
A5: 2023-08-11T00:00:00.000 | B5: 1 | C5: =RC[-2] -> 2023-08-11T00:00:00.000 | D5: =YEAR(RC[-3]) -> 2023 | E5: =IF(RC[-1]=Calendar!hols_year,Leave!RC[-3],0) -> 0
A6: 2023-08-14T00:00:00.000 | B6: 1 | C6: =RC[-2] -> 2023-08-14T00:00:00.000 | D6: =YEAR(RC[-3]) -> 2023 | E6: =IF(RC[-1]=Calendar!hols_year,Leave!RC[-3],0) -> 0
A7: 2023-08-15T00:00:00.000 | B7: 1 | C7: =RC[-2] -> 2023-08-15T00:00:00.000 | D7: =YEAR(RC[-3]) -> 2023 | E7: =IF(RC[-1]=Calendar!hols_year,Leave!RC[-3],0) -> 0
A8: 2023-08-16T00:00:00.000 | B8: 1 | C8: =RC[-2] -> 2023-08-16T00:00:00.000 | D8: =YEAR(RC[-3]) -> 2023 | E8: =IF(RC[-1]=Calendar!hols_year,Leave!RC[-3],0) -> 0
A9: 2023-08-17T00:00:00.000 | B9: 1 | C9: =RC[-2] -> 2023-08-17T00:00:00.000 | D9: =YEAR(RC[-3]) -> 2023 | E9: =IF(RC[-1]=Calendar!hols_year,Leave!RC[-3],0) -> 0
A10: 2023-08-18T00:00:00.000 | B10: 1 | C10: =RC[-2] -> 2023-08-18T00:00:00.000 | D10: =YEAR(RC[-3]) -> 2023 | E10: =IF(RC[-1]=Calendar!hols_year,Leave!RC[-3],0) -> 0
A12: 2023-04-05T00:00:00.000 | B12: 1 | C12: =RC[-2] -> 2023-04-05T00:00:00.000 | D12: =YEAR(RC[-3]) -> 2023 | E12: =IF(RC[-1]=Calendar!hols_year,Leave!RC[-3],0) -> 0
A13: 2023-04-06T00:00:00.000 | B13: 1 | C13: =RC[-2] -> 2023-04-06T00:00:00.000 | D13: =YEAR(RC[-3]) -> 2023 | E13: =IF(RC[-1]=Calendar!hols_year,Leave!RC[-3],0) -> 0
A14: 2023-04-11T00:00:00.000 | B14: 1 | C14: =RC[-2] -> 2023-04-11T00:00:00.000 | D14: =YEAR(RC[-3]) -> 2023 | E14: =IF(RC[-1]=Calendar!hols_year,Leave!RC[-3],0) -> 0
A15: 2023-04-12T00:00:00.000 | B15: 1 | C15: =RC[-2] -> 2023-04-12T00:00:00.000 | D15: =YEAR(RC[-3]) -> 2023 | E15: =IF(RC[-1]=Calendar!hols_year,Leave!RC[-3],0) -> 0
A16: 2023-04-13T00:00:00.000 | B16: 1 | C16: =RC[-2] -> 2023-04-13T00:00:00.000 | D16: =YEAR(RC[-3]) -> 2023 | E16: =IF(RC[-1]=Calendar!hols_year,Leave!RC[-3],0) -> 0
A17: 2023-04-14T00:00:00.000 | B17: 1 | C17: =RC[-2] -> 2023-04-14T00:00:00.000 | D17: =YEAR(RC[-3]) -> 2023 | E17: =IF(RC[-1]=Calendar!hols_year,Leave!RC[-3],0) -> 0
A19: 2023-06-01T00:00:00.000 | B19: 0.5 | C19: =RC[-2] -> 2023-06-01T00:00:00.000 | D19: =YEAR(RC[-3]) -> 2023 | E19: =IF(RC[-1]=Calendar!hols_year,Leave!RC[-3],0) -> 0
A21: 2023-10-05T00:00:00.000 | B21: 1 | C21: =RC[-2] -> 2023-10-05T00:00:00.000 | D21: =YEAR(RC[-3]) -> 2023 | E21: =IF(RC[-1]=Calendar!hols_year,Leave!RC[-3],0) -> 0 | F21: Stanley back to farm
A25: 2023-11-17T00:00:00.000 | B25: 1 | C25: =RC[-2] -> 2023-11-17T00:00:00.000 | D25: =YEAR(RC[-3]) -> 2023 | E25: =IF(RC[-1]=Calendar!hols_year,Leave!RC[-3],0) -> 0 | F25: Before loosing it
A26: 2023-12-01T00:00:00.000 | B26: 1 | C26: =RC[-2] -> 2023-12-01T00:00:00.000 | D26: =YEAR(RC[-3]) -> 2023 | E26: =IF(RC[-1]=Calendar!hols_year,Leave!RC[-3],0) -> 0 | F26: Before loosing it
A27: 2023-12-08T00:00:00.000 | B27: 1 | C27: =RC[-2] -> 2023-12-08T00:00:00.000 | D27: =YEAR(RC[-3]) -> 2023 | E27: =IF(RC[-1]=Calendar!hols_year,Leave!RC[-3],0) -> 0 | F27: Before loosing it
A28: 2023-12-18T00:00:00.000 | B28: 0.5 | C28: =RC[-2] -> 2023-12-18T00:00:00.000 | D28: =YEAR(RC[-3]) -> 2023 | E28: =IF(RC[-1]=Calendar!hols_year,Leave!RC[-3],0) -> 0 | F28: Before loosing it
A29: 2023-12-19T00:00:00.000 | B29: 1 | C29: =RC[-2] -> 2023-12-19T00:00:00.000 | D29: =YEAR(RC[-3]) -> 2023 | E29: =IF(RC[-1]=Calendar!hols_year,Leave!RC[-3],0) -> 0 | F29: Before loosing it
A30: 2023-12-20T00:00:00.000 | B30: 1 | C30: =RC[-2] -> 2023-12-20T00:00:00.000 | D30: =YEAR(RC[-3]) -> 2023 | E30: =IF(RC[-1]=Calendar!hols_year,Leave!RC[-3],0) -> 0 | F30: Before loosing it
A31: 2023-12-21T00:00:00.000 | B31: 1 | C31: =RC[-2] -> 2023-12-21T00:00:00.000 | D31: =YEAR(RC[-3]) -> 2023 | E31: =IF(RC[-1]=Calendar!hols_year,Leave!RC[-3],0) -> 0 | F31: Before loosing it
A32: 2023-12-27T00:00:00.000 | B32: 1 | C32: =RC[-2] -> 2023-12-27T00:00:00.000 | D32: =YEAR(RC[-3]) -> 2023 | E32: =IF(RC[-1]=Calendar!hols_year,Leave!RC[-3],0) -> 0 | F32: Before loosing it
A33: 2023-12-28T00:00:00.000 | B33: 1 | C33: =RC[-2] -> 2023-12-28T00:00:00.000 | D33: =YEAR(RC[-3]) -> 2023 | E33: =IF(RC[-1]=Calendar!hols_year,Leave!RC[-3],0) -> 0 | F33: Before loosing it

Sheet: BnkHols
A3: Bank Holidays | B3: Comment | F3: Shool Holidays
A4: 2023-05-08T00:00:00.000 | B4: Coronation | F4: 2024-02-16T00:00:00.000
F5: 2024-02-17T00:00:00.000
F6: 2024-02-18T00:00:00.000
A7: 2023-12-22T00:00:00.000 | B7: Extra Leave PIC | F7: 2024-02-19T00:00:00.000
A8: 2023-12-29T00:00:00.000 | B8: Extra Leave PIC | F8: 2024-02-20T00:00:00.000
F9: 2024-02-21T00:00:00.000
F10: 2024-02-22T00:00:00.000
F11: 2024-02-23T00:00:00.000
A12: 2011-04-22T00:00:00.000
A13: 2011-04-25T00:00:00.000
A14: 2011-04-29T00:00:00.000
A15: 2011-05-02T00:00:00.000
A16: 2011-05-30T00:00:00.000
A17: 2011-08-29T00:00:00.000
A18: 2010-04-02T00:00:00.000
A19: 2010-04-05T00:00:00.000
A20: 2010-05-03T00:00:00.000
A21: 2010-05-31T00:00:00.000
A22: 2010-08-30T00:00:00.000
A23: 2010-12-27T00:00:00.000
A24: 2010-12-28T00:00:00.000
A25: 2011-01-03T00:00:00.000
A26: 2011-12-26T00:00:00.000
A27: 2011-12-27T00:00:00.000
A28: 2012-01-02T00:00:00.000
A29: 2012-04-06T00:00:00.000
A30: 2012-04-09T00:00:00.000
A31: 2012-05-07T00:00:00.000
A32: 2012-06-04T00:00:00.000
A33: 2012-06-05T00:00:00.000
A34: 2012-08-27T00:00:00.000
A35: 2012-12-25T00:00:00.000
A36: 2012-12-26T00:00:00.000
A37: 2013-01-01T00:00:00.000
A38: 2013-03-29T00:00:00.000
A39: 2013-04-01T00:00:00.000
A40: 2013-05-06T00:00:00.000
A41: 2013-05-27T00:00:00.000
A42: 2014-12-25T00:00:00.000
A43: 2014-12-26T00:00:00.000
A44: 2015-01-01T00:00:00.000
A45: 2015-04-03T00:00:00.000
A46: 2015-04-06T00:00:00.000
A47: 2013-08-26T00:00:00.000
A48: 2013-12-25T00:00:00.000
A49: 2013-12-26T00:00:00.000
A50: 2014-01-01T00:00:00.000
A51: 2014-04-18T00:00:00.000
A52: 2014-04-21T00:00:00.000
A53: 2014-05-05T00:00:00.000
A54: 2014-05-26T00:00:00.000
A55: 2014-08-25T00:00:00.000
A56: 2015-05-04T00:00:00.000
A57: 2015-05-25T00:00:00.000
A58: 2015-08-31T00:00:00.000
A59: 2016-12-25T00:00:00.000
A60: 2016-12-26T00:00:00.000
A61: 2016-12-27T00:00:00.000
A62: 2017-01-01T00:00:00.000
A63: 2017-01-02T00:00:00.000
A64: 2015-12-25T00:00:00.000
A65: 2015-12-28T00:00:00.000
A66: 2016-01-01T00:00:00.000
A67: 2016-03-25T00:00:00.000
A68: 2016-03-28T00:00:00.000
A69: 2016-05-02T00:00:00.000
A70: 2016-05-30T00:00:00.000
A71: 2016-08-29T00:00:00.000
A72: 2018-05-07T00:00:00.000
A73: 2018-05-28T00:00:00.000
A74: 2018-08-27T00:00:00.000
A75: 2017-04-14T00:00:00.000
A76: 2017-04-17T00:00:00.000
A77: 2017-05-01T00:00:00.000
A78: 2017-05-29T00:00:00.000
A79: 2017-08-28T00:00:00.000
A80: 2017-12-25T00:00:00.000
A81: 2017-12-26T00:00:00.000
A82: 2018-01-01T00:00:00.000
A83: 2018-03-30T00:00:00.000
A84: 2018-04-02T00:00:00.000
A85: 2018-12-25T00:00:00.000
A86: 2018-12-26T00:00:00.000
A87: 2019-01-01T00:00:00.000
A88: 2020-08-31T00:00:00.000
A89: 2019-04-19T00:00:00.000
A90: 2019-04-22T00:00:00.000
A91: 2019-05-06T00:00:00.000
A92: 2019-05-27T00:00:00.000
A93: 2019-08-26T00:00:00.000
A94: 2019-12-25T00:00:00.000
A95: 2019-12-26T00:00:00.000
A96: 2020-01-01T00:00:00.000
A97: 2020-04-10T00:00:00.000
A98: 2020-04-13T00:00:00.000
A99: 2020-05-08T00:00:00.000
A100: 2020-05-25T00:00:00.000
A101: 2021-12-25T00:00:00.000
A102: 2021-12-26T00:00:00.000
A103: 2021-12-27T00:00:00.000
A104: 2021-12-28T00:00:00.000
A105: 2022-01-03T00:00:00.000
A106: 2022-04-15T00:00:00.000
A107: 2022-04-18T00:00:00.000
A108: 2020-12-25T00:00:00.000
A109: 2020-12-26T00:00:00.000
A110: 2020-12-28T00:00:00.000
A111: 2021-01-01T00:00:00.000
A112: 2021-04-02T00:00:00.000
A113: 2021-04-05T00:00:00.000
A114: 2021-05-03T00:00:00.000
A115: 2021-05-31T00:00:00.000
A116: 2021-08-30T00:00:00.000
A117: 2022-05-02T00:00:00.000
A118: 2022-06-02T00:00:00.000
A119: 2022-06-03T00:00:00.000
A120: 2022-08-29T00:00:00.000
A121: 2022-09-19T00:00:00.000
A122: 2023-12-25T00:00:00.000 | B122: Christmas Day
A123: 2023-12-26T00:00:00.000 | B123: Boxing Day
A124: 2024-01-01T00:00:00.000 | B124: New Year's Day
A125: 2022-12-25T00:00:00.000
A126: 2022-12-26T00:00:00.000
A127: 2022-12-27T00:00:00.000
A128: 2023-01-01T00:00:00.000
A129: 2023-01-02T00:00:00.000
A130: 2023-04-07T00:00:00.000
A131: 2023-04-10T00:00:00.000
A132: 2023-05-01T00:00:00.000
A133: 2023-05-29T00:00:00.000
A134: 2023-08-28T00:00:00.000 | B134: Summer bank holiday
A135: 2025-05-26T00:00:00.000 | B135: Spring bank holiday
A136: 2025-08-25T00:00:00.000 | B136: August Bank Holiday
A137: 2024-03-29T00:00:00.000 | B137: Good Friday
A138: 2024-04-01T00:00:00.000 | B138: Easter Monday
A139: 2024-05-06T00:00:00.000 | B139: Early May bank holiday
A140: 2024-05-27T00:00:00.000 | B140: Spring bank holiday
A141: 2024-08-26T00:00:00.000 | B141: August Bank Holiday
A142: 2024-12-25T00:00:00.000 | B142: Christmas Day
A143: 2024-12-26T00:00:00.000 | B143: Boxing Day
A144: 2025-01-01T00:00:00.000 | B144: New Year's Day
A145: 2025-04-18T00:00:00.000 | B145: Good Friday
A146: 2025-04-21T00:00:00.000 | B146: Easter Monday
A147: 2025-05-05T00:00:00.000 | B147: Early May bank holiday
A148: 2025-12-25T00:00:00.000 | B148: Christmas Day
A149: 2025-12-26T00:00:00.000 | B149: Boxing Day
A150: 2026-01-01T00:00:00.000 | B150: New Year's Day
A151: 2026-04-03T00:00:00.000 | B151: Good Friday
A152: 2026-04-06T00:00:00.000 | B152: Easter Monday
A153: 2027-08-30T00:00:00.000 | B153: August Bank Holiday
A154: 2026-05-04T00:00:00.000 | B154: Early May bank holiday
A155: 2026-05-25T00:00:00.000 | B155: Spring bank holiday
A156: 2026-08-31T00:00:00.000 | B156: August Bank Holiday
A157: 2026-12-25T00:00:00.000 | B157: Christmas Day
A158: 2026-12-26T00:00:00.000 | B158: Boxing Day
A159: 2026-12-28T00:00:00.000 | B159: Boxing Day substitute day (for Boxing Day)
A160: 2027-01-01T00:00:00.000 | B160: New Year's Day
A161: 2027-03-26T00:00:00.000 | B161: Good Friday
A162: 2027-03-29T00:00:00.000 | B162: Easter Monday
A163: 2027-05-03T00:00:00.000 | B163: Early May bank holiday
A164: 2027-05-31T00:00:00.000 | B164: Spring bank holiday
A165: 2027-12-25T00:00:00.000 | B165: Christmas Day
A166: 2027-12-26T00:00:00.000 | B166: Boxing Day
A167: 2027-12-27T00:00:00.000 | B167: Christmas Day substitute day (for Christmas Day)
A168: 2027-12-28T00:00:00.000 | B168: Boxing Day substitute day (for Boxing Day)
A169: 2028-01-01T00:00:00.000 | B169: New Year's Day
A170: 2028-01-03T00:00:00.000 | B170: New Year's Day substitute day (for New Year's Day)
A171: 2028-04-14T00:00:00.000 | B171: Good Friday
A172: 2028-04-17T00:00:00.000 | B172: Easter Monday
A173: 2028-05-01T00:00:00.000 | B173: Early May bank holiday
A174: 2028-05-29T00:00:00.000
A175: 2028-08-28T00:00:00.000
A176: 2028-12-25T00:00:00.000
A177: 2028-12-26T00:00:00.000

Sheet: stuff
D10: 2023-06-06T00:00:00.000 | E10: =RC[-1]-R[1]C[-1] -> 11
D11: 2023-05-26T00:00:00.000 | E11: =RC[-1]-R[1]C[-1] -> 16
D12: 2023-05-10T00:00:00.000 | E12: =RC[-1]-R[1]C[-1] -> 12
D13: 2023-04-28T00:00:00.000 | E13: =RC[-1]-R[1]C[-1] -> 17
D14: 2023-04-11T00:00:00.000 | E14: =RC[-1]-R[1]C[-1] -> 13
D15: 2023-03-29T00:00:00.000 | E15: =RC[-1]-R[1]C[-1] -> 16
D16: 2023-03-13T00:00:00.000 | E16: =RC[-1]-R[1]C[-1] -> 17
D17: 2023-02-24T00:00:00.000 | E17: =RC[-1]-R[1]C[-1] -> 26
D18: 2023-01-29T00:00:00.000 | E18: =RC[-1]-R[1]C[-1] -> 13
D19: 2023-01-16T00:00:00.000 | E19: =RC[-1]-R[1]C[-1] -> 12
D20: 2023-01-04T00:00:00.000